SiteName,Season,SurveyYear,SurveyDate,Section,ProtectionArea,NumHumans,NumLeashedDogs,NumUnleashedDogs,NumDogsRoaming,NumDogsChasingBirds,NumDogsChasingPlovers,NumPloversDisturbed,NumHorses,NumVehicles,Notes,QCFlag,QCNotes,SectorStartTime_CALCULATED,SectorEndTime_CALCULATED
Ocean Beach,WINTER,1994,12/8/1994,1,No,0,0,0,0,0,0,0,0,0,,,,1994-12-08T12:20:00Z,1994-12-08T12:20:00Z
Ocean Beach,WINTER,1994,12/8/1994,2,No,4,0,0,0,0,0,0,0,0,,,,1994-12-08T12:10:00Z,1994-12-08T12:20:00Z
Ocean Beach,WINTER,1994,12/8/1994,3,No,13,0,0,1,0,0,0,0,0,,,,1994-12-08T12:00:00Z,1994-12-08T12:10:00Z
Ocean Beach,WINTER,1994,12/8/1994,4,Yes,19,0,0,5,0,0,0,0,0,,,,1994-12-08T11:40:00Z,1994-12-08T12:00:00Z
Ocean Beach,WINTER,1994,12/8/1994,5,Yes,17,0,0,6,0,0,0,0,0,plane,,,1994-12-08T11:25:00Z,1994-12-08T11:40:00Z
Ocean Beach,WINTER,1994,12/8/1994,6,Yes,22,0,0,11,0,0,0,0,0,,,,1994-12-08T10:50:00Z,1994-12-08T11:25:00Z
Ocean Beach,WINTER,1994,12/8/1994,7,Yes,14,0,0,5,1,0,0,0,0,,,,1994-12-08T10:15:00Z,1994-12-08T10:50:00Z
Ocean Beach,WINTER,1994,12/8/1994,8,Yes,15,0,2,4,0,0,0,0,0,,,,1994-12-08T10:10:00Z,1994-12-08T11:03:00Z
Ocean Beach,WINTER,1994,12/8/1994,9,Yes,10,0,0,3,0,0,0,0,0,,,,1994-12-08T11:03:00Z,1994-12-08T11:28:00Z
Ocean Beach,WINTER,1994,12/8/1994,10,Yes,21,0,0,3,0,0,0,0,0,,,,1994-12-08T11:28:00Z,1994-12-08T11:48:00Z
Ocean Beach,WINTER,1994,12/8/1994,11,Yes,7,0,0,1,0,0,0,0,0,,,,1994-12-08T11:48:00Z,1994-12-08T12:05:00Z
Ocean Beach,WINTER,1994,12/8/1994,12,Yes,11,0,0,1,0,0,0,0,1,DFG ATV,,,1994-12-08T12:05:00Z,1994-12-08T12:08:00Z
Ocean Beach,WINTER,1994,12/8/1994,13,No,11,0,0,1,1,0,0,0,0,plane,,,1994-12-08T12:08:00Z,1994-12-08T12:18:00Z
Ocean Beach,WINTER,1994,12/8/1994,14,No,5,2,1,2,1,0,0,0,0,,,,1994-12-08T12:18:00Z,1994-12-08T12:30:00Z
Ocean Beach,WINTER,1994,12/15/1994,1,No,2,0,0,0,0,0,0,0,0,,,,1994-12-15T12:07:00Z,1994-12-15T12:10:00Z
Ocean Beach,WINTER,1994,12/15/1994,2,No,6,0,0,0,0,0,0,0,0,,,,1994-12-15T11:58:00Z,1994-12-15T12:07:00Z
Ocean Beach,WINTER,1994,12/15/1994,3,No,3,0,0,0,0,0,0,0,0,,,,1994-12-15T11:49:00Z,1994-12-15T11:58:00Z
Ocean Beach,WINTER,1994,12/15/1994,4,Yes,26,0,0,3,1,0,0,0,0,,,,1994-12-15T11:29:00Z,1994-12-15T11:49:00Z
Ocean Beach,WINTER,1994,12/15/1994,5,Yes,6,1,0,1,0,0,0,0,0,,,,1994-12-15T11:02:00Z,1994-12-15T11:29:00Z
Ocean Beach,WINTER,1994,12/15/1994,6,Yes,4,0,1,1,0,0,0,0,0,,,,1994-12-15T10:33:00Z,1994-12-15T11:02:00Z
Ocean Beach,WINTER,1994,12/15/1994,7,Yes,6,0,0,2,0,0,0,0,0,helicopter,,,1994-12-15T10:05:00Z,1994-12-15T10:33:00Z
Ocean Beach,WINTER,1994,12/15/1994,8,Yes,16,0,5,2,0,1,0,0,0,,,,1994-12-15T10:15:00Z,1994-12-15T11:15:00Z
Ocean Beach,WINTER,1994,12/15/1994,9,Yes,5,0,1,1,0,0,0,0,0,,,,1994-12-15T11:15:00Z,1994-12-15T11:20:00Z
Ocean Beach,WINTER,1994,12/15/1994,10,Yes,3,0,1,1,0,0,0,0,0,,,,1994-12-15T11:20:00Z,1994-12-15T11:35:00Z
Ocean Beach,WINTER,1994,12/15/1994,11,Yes,5,0,0,0,0,0,0,0,0,,,,1994-12-15T11:35:00Z,1994-12-15T11:40:00Z
Ocean Beach,WINTER,1994,12/15/1994,12,Yes,6,1,1,2,0,0,0,0,0,,,,1994-12-15T11:40:00Z,1994-12-15T11:50:00Z
Ocean Beach,WINTER,1994,12/15/1994,13,No,6,0,0,1,0,0,0,0,0,,,,1994-12-15T11:50:00Z,1994-12-15T12:00:00Z
Ocean Beach,WINTER,1994,12/15/1994,14,No,2,1,3,1,0,0,0,0,0,,,,1994-12-15T12:00:00Z,1994-12-15T12:00:00Z
Ocean Beach,WINTER,1994,12/17/1994,1,No,21,0,0,1,0,0,0,0,0,,,,1994-12-17T16:31:00Z,1994-12-17T16:31:00Z
Ocean Beach,WINTER,1994,12/17/1994,2,No,30,1,0,2,0,0,0,0,0,,,,1994-12-17T16:20:00Z,1994-12-17T16:31:00Z
Ocean Beach,WINTER,1994,12/17/1994,3,No,37,0,1,1,0,0,0,0,0,,,,1994-12-17T16:02:00Z,1994-12-17T16:20:00Z
Ocean Beach,WINTER,1994,12/17/1994,4,Yes,28,1,2,1,0,0,0,0,0,,,,1994-12-17T15:45:00Z,1994-12-17T16:02:00Z
Ocean Beach,WINTER,1994,12/17/1994,5,Yes,30,0,2,1,0,0,0,0,0,,,,1994-12-17T15:19:00Z,1994-12-17T15:45:00Z
Ocean Beach,WINTER,1994,12/17/1994,6,Yes,46,0,7,4,0,0,0,0,0,,,,1994-12-17T14:35:00Z,1994-12-17T15:19:00Z
Ocean Beach,WINTER,1994,12/17/1994,7,Yes,15,0,0,4,0,0,0,0,0,,,,1994-12-17T14:16:00Z,1994-12-17T14:35:00Z
Ocean Beach,WINTER,1994,12/17/1994,8,Yes,30,0,4,3,2,0,0,0,0,,,,1994-12-17T14:25:00Z,1994-12-17T15:10:00Z
Ocean Beach,WINTER,1994,12/17/1994,9,Yes,13,0,1,2,3,0,0,0,0,,,,1994-12-17T15:10:00Z,1994-12-17T15:30:00Z
Ocean Beach,WINTER,1994,12/17/1994,10,Yes,8,0,2,4,1,0,0,0,0,,,,1994-12-17T15:30:00Z,1994-12-17T15:40:00Z
Ocean Beach,WINTER,1994,12/17/1994,11,Yes,12,0,0,2,0,0,0,0,0,,,,1994-12-17T15:40:00Z,1994-12-17T15:50:00Z
Ocean Beach,WINTER,1994,12/17/1994,12,Yes,16,0,2,1,0,0,0,0,0,,,,1994-12-17T15:50:00Z,1994-12-17T16:00:00Z
Ocean Beach,WINTER,1994,12/17/1994,13,No,30,1,0,2,0,0,0,0,0,,,,1994-12-17T16:00:00Z,1994-12-17T16:10:00Z
Ocean Beach,WINTER,1994,12/17/1994,14,No,11,0,2,1,0,0,0,0,0,,,,1994-12-17T16:10:00Z,1994-12-17T16:15:00Z
Ocean Beach,WINTER,1994,1/3/1995,1,No,4,0,0,0,0,0,0,0,1,bulldozer,,,1995-01-03T11:46:00Z,1995-01-03T12:00:00Z
Ocean Beach,WINTER,1994,1/3/1995,2,No,8,0,2,1,1,0,0,0,0,,,,1995-01-03T11:32:00Z,1995-01-03T11:46:00Z
Ocean Beach,WINTER,1994,1/3/1995,3,No,6,0,0,2,0,0,0,0,0,,,,1995-01-03T11:15:00Z,1995-01-03T11:32:00Z
Ocean Beach,WINTER,1994,1/3/1995,4,Yes,10,0,0,0,0,0,0,0,0,,,,1995-01-03T10:55:00Z,1995-01-03T11:15:00Z
Ocean Beach,WINTER,1994,1/3/1995,5,Yes,4,0,0,1,1,0,0,0,0,helicopter-hc,,,1995-01-03T10:30:00Z,1995-01-03T10:55:00Z
Ocean Beach,WINTER,1994,1/3/1995,6,Yes,11,1,1,1,0,0,0,0,0,,,,1995-01-03T10:10:00Z,1995-01-03T10:30:00Z
Ocean Beach,WINTER,1994,1/3/1995,7,Yes,3,0,0,1,2,0,0,0,0,,,,1995-01-03T09:48:00Z,1995-01-03T10:10:00Z
Ocean Beach,WINTER,1994,1/3/1995,8,Yes,8,3,1,0,0,0,1,0,0,"plover dist, 1hc",,,1995-01-03T10:00:00Z,1995-01-03T10:45:00Z
Ocean Beach,WINTER,1994,1/3/1995,9,Yes,3,0,0,0,0,0,0,0,0,,,,1995-01-03T10:45:00Z,1995-01-03T11:20:00Z
Ocean Beach,WINTER,1994,1/3/1995,10,Yes,7,0,3,0,0,0,0,0,0,,,,1995-01-03T11:20:00Z,1995-01-03T11:25:00Z
Ocean Beach,WINTER,1994,1/3/1995,11,Yes,3,0,2,0,0,0,0,0,0,,,,1995-01-03T11:25:00Z,1995-01-03T11:45:00Z
Ocean Beach,WINTER,1994,1/3/1995,12,Yes,5,0,1,0,0,0,0,0,0,,,,1995-01-03T11:45:00Z,1995-01-03T11:50:00Z
Ocean Beach,WINTER,1994,1/3/1995,13,No,5,0,3,0,0,0,0,0,0,,,,1995-01-03T11:50:00Z,1995-01-03T11:55:00Z
Ocean Beach,WINTER,1994,1/3/1995,14,No,2,0,1,0,0,0,0,0,0,,,,1995-01-03T11:55:00Z,1995-01-03T12:00:00Z
Ocean Beach,WINTER,1994,1/7/1995,1,No,7,0,0,0,0,0,0,0,0,,,,1995-01-07T15:05:00Z,1995-01-07T15:10:00Z
Ocean Beach,WINTER,1994,1/7/1995,2,No,24,0,0,3,0,0,0,0,0,1 low hc,,,1995-01-07T14:55:00Z,1995-01-07T15:05:00Z
Ocean Beach,WINTER,1994,1/7/1995,3,No,35,0,0,4,0,0,0,0,0,hman on bike/1 kite,,,1995-01-07T14:45:00Z,1995-01-07T14:55:00Z
Ocean Beach,WINTER,1994,1/7/1995,4,Yes,25,0,0,7,0,0,0,0,0,,,,1995-01-07T14:30:00Z,1995-01-07T14:45:00Z
Ocean Beach,WINTER,1994,1/7/1995,5,Yes,41,0,0,1,0,0,0,0,0,,,,1995-01-07T14:00:00Z,1995-01-07T14:30:00Z
Ocean Beach,WINTER,1994,1/7/1995,6,Yes,18,0,0,2,0,0,0,0,0,,,,1995-01-07T13:50:00Z,1995-01-07T14:00:00Z
Ocean Beach,WINTER,1994,1/7/1995,7,Yes,9,0,0,2,1,0,0,0,0,,,,1995-01-07T13:25:00Z,1995-01-07T13:50:00Z
Ocean Beach,WINTER,1994,1/7/1995,8,Yes,9,0,0,3,0,0,0,0,0,,,,1995-01-07T13:30:00Z,1995-01-07T13:37:00Z
Ocean Beach,WINTER,1994,1/7/1995,9,Yes,10,0,0,0,0,0,0,0,0,,,,1995-01-07T13:37:00Z,1995-01-07T14:16:00Z
Ocean Beach,WINTER,1994,1/7/1995,10,Yes,1,0,0,0,0,0,0,0,0,,,,1995-01-07T14:16:00Z,1995-01-07T14:36:00Z
Ocean Beach,WINTER,1994,1/7/1995,11,Yes,8,0,0,3,0,0,0,0,0,,,,1995-01-07T14:36:00Z,1995-01-07T14:46:00Z
Ocean Beach,WINTER,1994,1/7/1995,12,Yes,13,0,0,1,0,0,0,0,0,,,,1995-01-07T14:46:00Z,1995-01-07T14:56:00Z
Ocean Beach,WINTER,1994,1/7/1995,13,No,7,0,0,1,0,0,0,0,0,,,,1995-01-07T14:56:00Z,1995-01-07T15:03:00Z
Ocean Beach,WINTER,1994,1/7/1995,14,No,0,0,0,0,0,0,0,0,0,1 hc,,,1995-01-07T15:03:00Z,1995-01-07T15:15:00Z
Ocean Beach,WINTER,1994,1/11/1995,1,No,4,0,0,0,0,0,0,0,0,,,,1995-01-11T10:50:00Z,1995-01-11T10:55:00Z
Ocean Beach,WINTER,1994,1/11/1995,2,No,12,0,0,1,0,0,0,0,0,,,,1995-01-11T10:40:00Z,1995-01-11T10:50:00Z
Ocean Beach,WINTER,1994,1/11/1995,3,No,9,0,0,3,0,0,0,0,0,,,,1995-01-11T10:30:00Z,1995-01-11T10:40:00Z
Ocean Beach,WINTER,1994,1/11/1995,4,Yes,18,0,1,6,0,0,0,0,1,bulldozer,,,1995-01-11T10:20:00Z,1995-01-11T10:30:00Z
Ocean Beach,WINTER,1994,1/11/1995,5,Yes,11,0,1,1,0,0,0,0,0,hman w/bike,,,1995-01-11T10:00:00Z,1995-01-11T10:20:00Z
Ocean Beach,WINTER,1994,1/11/1995,6,Yes,9,0,1,0,0,0,0,0,0,,,,1995-01-11T09:35:00Z,1995-01-11T10:00:00Z
Ocean Beach,WINTER,1994,1/11/1995,7,Yes,7,0,0,1,1,0,0,0,0,,,,1995-01-11T09:15:00Z,1995-01-11T09:35:00Z
Ocean Beach,WINTER,1994,1/11/1995,8,Yes,11,0,1,0,1,0,0,0,0,,,,1995-01-11T09:23:00Z,1995-01-11T09:50:00Z
Ocean Beach,WINTER,1994,1/11/1995,9,Yes,13,0,1,2,0,0,0,0,0,,,,1995-01-11T09:50:00Z,1995-01-11T10:35:00Z
Ocean Beach,WINTER,1994,1/11/1995,10,Yes,8,0,0,0,1,0,0,0,0,,,,1995-01-11T10:35:00Z,1995-01-11T10:45:00Z
Ocean Beach,WINTER,1994,1/11/1995,11,Yes,8,0,3,1,1,0,0,0,0,,,,1995-01-11T10:45:00Z,1995-01-11T10:52:00Z
Ocean Beach,WINTER,1994,1/11/1995,12,Yes,10,0,0,0,0,0,0,0,0,,,,1995-01-11T10:52:00Z,1995-01-11T11:06:00Z
Ocean Beach,WINTER,1994,1/11/1995,13,No,2,0,0,0,0,0,0,0,0,,,,1995-01-11T11:06:00Z,1995-01-11T11:30:00Z
Ocean Beach,WINTER,1994,1/11/1995,14,No,0,0,0,0,0,0,0,0,0,not surveyed,,,1995-01-11T11:30:00Z,1995-01-11T11:30:00Z
Ocean Beach,WINTER,1994,1/14/1995,1,No,18,1,0,0,0,0,0,0,0,,,,1995-01-14T15:21:00Z,1995-01-14T15:25:00Z
Ocean Beach,WINTER,1994,1/14/1995,2,No,14,1,1,0,0,0,0,0,0,,,,1995-01-14T15:12:00Z,1995-01-14T15:21:00Z
Ocean Beach,WINTER,1994,1/14/1995,3,No,22,0,1,8,0,0,0,0,0,,,,1995-01-14T15:00:00Z,1995-01-14T15:12:00Z
Ocean Beach,WINTER,1994,1/14/1995,4,Yes,28,0,1,0,0,0,0,0,0,5 hmans w/bikes,,,1995-01-14T14:46:00Z,1995-01-14T15:00:00Z
Ocean Beach,WINTER,1994,1/14/1995,5,Yes,30,0,8,1,1,0,0,0,0,,,,1995-01-14T14:21:00Z,1995-01-14T14:46:00Z
Ocean Beach,WINTER,1994,1/14/1995,6,Yes,22,0,3,3,0,0,0,0,0,fire/12martial arts,,,1995-01-14T14:04:00Z,1995-01-14T14:21:00Z
Ocean Beach,WINTER,1994,1/14/1995,7,Yes,20,0,5,4,0,0,0,0,0,,,,1995-01-14T13:26:00Z,1995-01-14T14:04:00Z
Ocean Beach,WINTER,1994,1/14/1995,8,Yes,14,1,1,3,1,0,0,0,0,,,,1995-01-14T13:46:00Z,1995-01-14T14:15:00Z
Ocean Beach,WINTER,1994,1/14/1995,9,Yes,15,2,1,1,1,0,0,0,0,,,,1995-01-14T14:15:00Z,1995-01-14T14:40:00Z
Ocean Beach,WINTER,1994,1/14/1995,10,Yes,20,1,0,2,0,0,0,0,0,,,,1995-01-14T14:40:00Z,1995-01-14T15:01:00Z
Ocean Beach,WINTER,1994,1/14/1995,11,Yes,6,1,0,3,0,0,0,0,0,,,,1995-01-14T15:01:00Z,1995-01-14T15:11:00Z
Ocean Beach,WINTER,1994,1/14/1995,12,Yes,23,0,0,2,0,0,0,0,0,,,,1995-01-14T15:11:00Z,1995-01-14T15:15:00Z
Ocean Beach,WINTER,1994,1/14/1995,13,No,6,0,0,2,0,0,0,0,0,,,,1995-01-14T15:15:00Z,1995-01-14T15:25:00Z
Ocean Beach,WINTER,1994,1/14/1995,14,No,8,0,2,2,0,0,0,0,0,,,,1995-01-14T15:25:00Z,1995-01-14T15:30:00Z
Ocean Beach,WINTER,1994,1/17/1995,1,No,33,0,0,0,0,0,0,0,0,Ranger walk,,,1995-01-17T11:23:00Z,1995-01-17T11:25:00Z
Ocean Beach,WINTER,1994,1/17/1995,2,No,13,1,2,0,0,0,0,0,1,"bulldozer,5 surfers",,,1995-01-17T11:10:00Z,1995-01-17T11:23:00Z
Ocean Beach,WINTER,1994,1/17/1995,3,No,7,0,2,0,0,0,0,0,0,,,,1995-01-17T11:00:00Z,1995-01-17T11:10:00Z
Ocean Beach,WINTER,1994,1/17/1995,4,Yes,23,1,10,1,0,0,0,0,0,,,,1995-01-17T10:40:00Z,1995-01-17T11:00:00Z
Ocean Beach,WINTER,1994,1/17/1995,5,Yes,18,2,3,2,0,0,0,0,0,"DL dist plovers,1 hc",,,1995-01-17T10:10:00Z,1995-01-17T10:40:00Z
Ocean Beach,WINTER,1994,1/17/1995,6,Yes,7,3,1,0,1,0,0,0,0,,,,1995-01-17T09:45:00Z,1995-01-17T10:10:00Z
Ocean Beach,WINTER,1994,1/17/1995,7,Yes,11,1,2,2,0,0,0,0,0,,,,1995-01-17T09:30:00Z,1995-01-17T09:45:00Z
Ocean Beach,WINTER,1994,1/17/1995,8,Yes,12,1,2,3,2,0,0,0,0,,,,1995-01-17T09:30:00Z,1995-01-17T10:10:00Z
Ocean Beach,WINTER,1994,1/17/1995,9,Yes,10,0,0,0,0,0,0,0,0,1 low hc,,,1995-01-17T10:10:00Z,1995-01-17T10:45:00Z
Ocean Beach,WINTER,1994,1/17/1995,10,Yes,7,0,0,0,0,0,0,0,0,,,,1995-01-17T10:45:00Z,1995-01-17T11:00:00Z
Ocean Beach,WINTER,1994,1/17/1995,11,Yes,4,0,1,1,0,0,0,0,0,,,,1995-01-17T11:00:00Z,1995-01-17T11:10:00Z
Ocean Beach,WINTER,1994,1/17/1995,12,Yes,12,0,0,2,0,0,0,0,0,,,,1995-01-17T11:10:00Z,1995-01-17T11:20:00Z
Ocean Beach,WINTER,1994,1/17/1995,13,No,1,0,0,0,0,0,0,0,0,"end 1125, no beach",,,1995-01-17T11:20:00Z,1995-01-17T11:25:00Z
Ocean Beach,WINTER,1994,1/17/1995,14,No,0,0,0,0,0,0,0,0,0,not surveyed,,,1995-01-17T11:25:00Z,1995-01-17T11:25:00Z
Ocean Beach,WINTER,1994,1/21/1995,1,No,8,0,0,0,0,0,0,0,0,,,,1995-01-21T14:48:00Z,1995-01-21T15:00:00Z
Ocean Beach,WINTER,1994,1/21/1995,2,No,31,0,1,2,1,0,0,0,0,,,,1995-01-21T14:40:00Z,1995-01-21T14:48:00Z
Ocean Beach,WINTER,1994,1/21/1995,3,No,35,0,0,1,0,0,0,0,0,,,,1995-01-21T14:30:00Z,1995-01-21T14:40:00Z
Ocean Beach,WINTER,1994,1/21/1995,4,Yes,43,2,0,4,1,0,0,7,0,,,,1995-01-21T14:15:00Z,1995-01-21T14:30:00Z
Ocean Beach,WINTER,1994,1/21/1995,5,Yes,22,1,0,3,0,1,0,0,0,,,,1995-01-21T14:05:00Z,1995-01-21T14:15:00Z
Ocean Beach,WINTER,1994,1/21/1995,6,Yes,38,2,0,8,1,1,0,0,0,,,,1995-01-21T13:36:00Z,1995-01-21T14:05:00Z
Ocean Beach,WINTER,1994,1/21/1995,7,Yes,20,1,0,1,1,0,0,0,0,,,,1995-01-21T13:25:00Z,1995-01-21T13:36:00Z
Ocean Beach,WINTER,1994,1/21/1995,8,Yes,27,1,2,1,1,2,0,0,0,,,,1995-01-21T13:20:00Z,1995-01-21T14:00:00Z
Ocean Beach,WINTER,1994,1/21/1995,9,Yes,29,1,2,2,2,1,0,0,0,,,,1995-01-21T14:00:00Z,1995-01-21T14:35:00Z
Ocean Beach,WINTER,1994,1/21/1995,10,Yes,14,0,5,3,1,0,0,0,0,,,,1995-01-21T14:35:00Z,1995-01-21T14:50:00Z
Ocean Beach,WINTER,1994,1/21/1995,11,Yes,19,0,1,3,0,0,0,0,0,,,,1995-01-21T14:50:00Z,1995-01-21T15:05:00Z
Ocean Beach,WINTER,1994,1/21/1995,12,Yes,16,0,2,3,0,0,0,0,0,,,,1995-01-21T15:05:00Z,1995-01-21T15:15:00Z
Ocean Beach,WINTER,1994,1/21/1995,13,No,12,1,1,2,0,0,0,0,0,"end 1520, no beach",,,1995-01-21T15:15:00Z,1995-01-21T15:25:00Z
Ocean Beach,WINTER,1994,1/21/1995,14,No,0,0,0,0,0,0,0,0,0,not surveyed,,,1995-01-21T15:25:00Z,1995-01-21T15:25:00Z
Ocean Beach,WINTER,1994,1/25/1995,1,No,10,0,0,0,0,0,0,0,0,,,,1995-01-25T11:10:00Z,1995-01-25T11:15:00Z
Ocean Beach,WINTER,1994,1/25/1995,2,No,18,0,0,0,0,0,0,0,0,1hc,,,1995-01-25T11:05:00Z,1995-01-25T11:10:00Z
Ocean Beach,WINTER,1994,1/25/1995,3,No,27,0,0,1,0,0,0,0,1,1hc/1bulldozer,,,1995-01-25T10:40:00Z,1995-01-25T11:05:00Z
Ocean Beach,WINTER,1994,1/25/1995,4,Yes,25,0,1,1,0,0,0,0,0,fire,,,1995-01-25T10:25:00Z,1995-01-25T10:40:00Z
Ocean Beach,WINTER,1994,1/25/1995,5,Yes,20,0,1,1,1,0,0,0,0,,,,1995-01-25T10:00:00Z,1995-01-25T10:25:00Z
Ocean Beach,WINTER,1994,1/25/1995,6,Yes,27,0,2,1,1,0,0,0,0,"c=cormorant,fire",,,1995-01-25T09:40:00Z,1995-01-25T10:00:00Z
Ocean Beach,WINTER,1994,1/25/1995,7,Yes,13,1,2,1,0,0,0,0,0,,,,1995-01-25T09:22:00Z,1995-01-25T09:40:00Z
Ocean Beach,WINTER,1994,1/25/1995,8,Yes,19,0,0,6,0,0,0,0,0,,,,1995-01-25T09:36:00Z,1995-01-25T10:15:00Z
Ocean Beach,WINTER,1994,1/25/1995,9,Yes,15,0,1,2,0,0,0,0,0,,,,1995-01-25T10:15:00Z,1995-01-25T10:29:00Z
Ocean Beach,WINTER,1994,1/25/1995,10,Yes,6,0,0,1,0,0,0,0,0,,,,1995-01-25T10:29:00Z,1995-01-25T10:40:00Z
Ocean Beach,WINTER,1994,1/25/1995,11,Yes,5,0,0,1,0,0,0,0,0,,,,1995-01-25T10:40:00Z,1995-01-25T10:46:00Z
Ocean Beach,WINTER,1994,1/25/1995,12,Yes,4,0,0,2,0,0,0,0,0,1 low hc,,,1995-01-25T10:46:00Z,1995-01-25T10:50:00Z
Ocean Beach,WINTER,1994,1/25/1995,13,No,3,0,0,1,0,0,0,0,0,,,,1995-01-25T10:50:00Z,1995-01-25T10:55:00Z
Ocean Beach,WINTER,1994,1/25/1995,14,No,4,1,0,2,0,0,0,0,0,,,,1995-01-25T10:55:00Z,1995-01-25T11:00:00Z
Ocean Beach,WINTER,1994,1/28/1995,1,No,31,0,0,2,0,0,0,0,0,,,,1995-01-28T14:45:00Z,1995-01-28T14:50:00Z
Ocean Beach,WINTER,1994,1/28/1995,2,No,58,0,1,5,0,0,0,0,0,low plane,,,1995-01-28T14:35:00Z,1995-01-28T14:45:00Z
Ocean Beach,WINTER,1994,1/28/1995,3,No,65,1,1,0,0,0,0,1,0,"4w/frisbee,bik",,,1995-01-28T14:20:00Z,1995-01-28T14:35:00Z
Ocean Beach,WINTER,1994,1/28/1995,4,Yes,88,1,5,7,1,0,0,0,1,"1kite,car,2w/bikes",,,1995-01-28T14:00:00Z,1995-01-28T14:20:00Z
Ocean Beach,WINTER,1994,1/28/1995,5,Yes,59,0,4,2,0,0,0,0,0,,,,1995-01-28T13:45:00Z,1995-01-28T14:00:00Z
Ocean Beach,WINTER,1994,1/28/1995,6,Yes,32,0,1,1,1,0,0,0,0,1 fisherman,,,1995-01-28T13:25:00Z,1995-01-28T13:45:00Z
Ocean Beach,WINTER,1994,1/28/1995,7,Yes,39,0,0,5,2,0,0,0,0,,,,1995-01-28T13:20:00Z,1995-01-28T13:25:00Z
Ocean Beach,WINTER,1994,1/28/1995,8,Yes,20,1,2,3,2,0,0,0,0,20surfers(not in hm),,,1995-01-28T13:20:00Z,1995-01-28T13:50:00Z
Ocean Beach,WINTER,1994,1/28/1995,9,Yes,22,0,0,4,0,0,0,0,0,"15+surfers,1 bike",,,1995-01-28T13:50:00Z,1995-01-28T14:10:00Z
Ocean Beach,WINTER,1994,1/28/1995,10,Yes,21,0,1,4,0,0,0,0,0,,,,1995-01-28T14:10:00Z,1995-01-28T14:20:00Z
Ocean Beach,WINTER,1994,1/28/1995,11,Yes,26,0,2,0,0,0,0,0,0,,,,1995-01-28T14:20:00Z,1995-01-28T14:35:00Z
Ocean Beach,WINTER,1994,1/28/1995,12,Yes,10,0,1,0,1,0,0,0,0,,,,1995-01-28T14:35:00Z,1995-01-28T14:42:00Z
Ocean Beach,WINTER,1994,1/28/1995,13,No,34,1,0,2,1,0,0,0,0,,,,1995-01-28T14:42:00Z,1995-01-28T14:57:00Z
Ocean Beach,WINTER,1994,1/28/1995,14,No,42,0,1,8,0,0,0,0,0,"2planes,buow at basw",,,1995-01-28T14:57:00Z,1995-01-28T15:00:00Z
Ocean Beach,WINTER,1994,1/31/1995,1,No,3,0,0,0,0,0,0,0,1,bulldozer,,,1995-01-31T11:05:00Z,1995-01-31T11:10:00Z
Ocean Beach,WINTER,1994,1/31/1995,2,No,13,0,2,1,2,0,0,0,0,,,,1995-01-31T10:45:00Z,1995-01-31T11:05:00Z
Ocean Beach,WINTER,1994,1/31/1995,3,No,6,0,0,0,0,0,0,0,0,bulldozer marks,,,1995-01-31T10:35:00Z,1995-01-31T10:45:00Z
Ocean Beach,WINTER,1994,1/31/1995,4,Yes,20,0,0,0,0,0,0,0,0,,,,1995-01-31T10:20:00Z,1995-01-31T10:35:00Z
Ocean Beach,WINTER,1994,1/31/1995,5,Yes,10,0,3,0,1,0,0,0,0,,,,1995-01-31T10:05:00Z,1995-01-31T10:20:00Z
Ocean Beach,WINTER,1994,1/31/1995,6,Yes,7,0,2,2,1,0,0,0,0,,,,1995-01-31T09:50:00Z,1995-01-31T10:05:00Z
Ocean Beach,WINTER,1994,1/31/1995,7,Yes,16,0,2,4,0,0,0,0,0,beach narrow,,,1995-01-31T09:31:00Z,1995-01-31T09:50:00Z
Ocean Beach,WINTER,1994,1/31/1995,8,Yes,15,0,5,1,0,0,0,0,0,,,,1995-01-31T09:35:00Z,1995-01-31T10:10:00Z
Ocean Beach,WINTER,1994,1/31/1995,9,Yes,22,3,2,0,1,1,0,0,0,1 DL chasing plovers,,,1995-01-31T10:10:00Z,1995-01-31T10:54:00Z
Ocean Beach,WINTER,1994,1/31/1995,10,Yes,4,0,0,1,0,0,0,0,0,,,,1995-01-31T10:54:00Z,1995-01-31T11:05:00Z
Ocean Beach,WINTER,1994,1/31/1995,11,Yes,12,0,0,0,0,0,0,0,0,,,,1995-01-31T11:05:00Z,1995-01-31T11:20:00Z
Ocean Beach,WINTER,1994,1/31/1995,12,Yes,10,1,0,1,1,0,0,0,0,,,,1995-01-31T11:20:00Z,1995-01-31T11:40:00Z
Ocean Beach,WINTER,1994,1/31/1995,13,No,0,0,0,0,0,0,0,0,0,not surveyed,,,1995-01-31T11:40:00Z,1995-01-31T11:40:00Z
Ocean Beach,WINTER,1994,1/31/1995,14,No,0,0,0,0,0,0,0,0,0,not surveyed,,,1995-01-31T11:40:00Z,1995-01-31T11:40:00Z
Ocean Beach,WINTER,1994,2/4/1995,1,No,32,0,2,0,0,0,0,0,0,,,,1995-02-04T15:02:00Z,1995-02-04T15:10:00Z
Ocean Beach,WINTER,1994,2/4/1995,2,No,52,0,1,3,1,0,0,0,0,,,,1995-02-04T14:45:00Z,1995-02-04T15:02:00Z
Ocean Beach,WINTER,1994,2/4/1995,3,No,52,1,1,1,0,0,0,0,0,,,,1995-02-04T14:35:00Z,1995-02-04T14:45:00Z
Ocean Beach,WINTER,1994,2/4/1995,4,Yes,63,1,0,7,0,0,0,0,0,,,,1995-02-04T14:20:00Z,1995-02-04T14:35:00Z
Ocean Beach,WINTER,1994,2/4/1995,5,Yes,54,2,1,3,0,0,0,3,0,,,,1995-02-04T14:00:00Z,1995-02-04T14:20:00Z
Ocean Beach,WINTER,1994,2/4/1995,6,Yes,32,2,3,8,0,0,0,0,0,,,,1995-02-04T13:35:00Z,1995-02-04T14:00:00Z
Ocean Beach,WINTER,1994,2/4/1995,7,Yes,40,1,4,14,0,0,0,0,0,,,,1995-02-04T13:20:00Z,1995-02-04T13:35:00Z
Ocean Beach,WINTER,1994,2/4/1995,8,Yes,23,0,3,2,0,0,0,0,0,1 fisherman,,,1995-02-04T13:20:00Z,1995-02-04T13:40:00Z
Ocean Beach,WINTER,1994,2/4/1995,9,Yes,38,1,1,6,0,0,0,4,0,1 rngr horse patrol,,,1995-02-04T13:40:00Z,1995-02-04T14:10:00Z
Ocean Beach,WINTER,1994,2/4/1995,10,Yes,27,0,1,4,1,0,0,0,0,3w/frisbee,,,1995-02-04T14:10:00Z,1995-02-04T14:20:00Z
Ocean Beach,WINTER,1994,2/4/1995,11,Yes,36,0,0,1,1,0,0,0,0,"fire,2w/ball",,,1995-02-04T14:20:00Z,1995-02-04T14:35:00Z
Ocean Beach,WINTER,1994,2/4/1995,12,Yes,44,1,3,1,0,0,0,0,0,smoldering fire,,,1995-02-04T14:35:00Z,1995-02-04T14:45:00Z
Ocean Beach,WINTER,1994,2/4/1995,13,No,32,1,0,0,0,0,0,0,0,"end 1445, no beach",,,1995-02-04T14:45:00Z,1995-02-04T14:45:00Z
Ocean Beach,WINTER,1994,2/4/1995,14,No,0,0,0,0,0,0,0,0,0,not surveyed,,,1995-02-04T14:45:00Z,1995-02-04T14:45:00Z
Ocean Beach,WINTER,1994,2/9/1995,1,No,7,0,0,2,0,0,0,0,0,,,,1995-02-09T10:40:00Z,1995-02-09T10:40:00Z
Ocean Beach,WINTER,1994,2/9/1995,2,No,21,0,1,3,0,0,0,0,0,,,,1995-02-09T10:30:00Z,1995-02-09T10:40:00Z
Ocean Beach,WINTER,1994,2/9/1995,3,No,28,0,0,1,0,0,0,0,0,2 bikes,,,1995-02-09T10:22:00Z,1995-02-09T10:30:00Z
Ocean Beach,WINTER,1994,2/9/1995,4,Yes,60,1,0,2,0,0,0,0,0,,,,1995-02-09T10:06:00Z,1995-02-09T10:22:00Z
Ocean Beach,WINTER,1994,2/9/1995,5,Yes,40,1,0,3,0,0,0,2,0,,,,1995-02-09T09:47:00Z,1995-02-09T10:06:00Z
Ocean Beach,WINTER,1994,2/9/1995,6,Yes,24,0,0,2,0,0,0,0,0,,,,1995-02-09T09:30:00Z,1995-02-09T09:47:00Z
Ocean Beach,WINTER,1994,2/9/1995,7,Yes,23,0,0,1,1,0,0,0,0,,,,1995-02-09T09:20:00Z,1995-02-09T09:30:00Z
Ocean Beach,WINTER,1994,2/9/1995,8,Yes,23,0,0,5,0,0,0,0,0,,,,1995-02-09T09:25:00Z,1995-02-09T09:50:00Z
Ocean Beach,WINTER,1994,2/9/1995,9,Yes,17,3,1,3,0,0,0,0,0,,,,1995-02-09T09:50:00Z,1995-02-09T10:25:00Z
Ocean Beach,WINTER,1994,2/9/1995,10,Yes,10,14,0,1,1,0,0,0,0,,,,1995-02-09T10:25:00Z,1995-02-09T10:35:00Z
Ocean Beach,WINTER,1994,2/9/1995,11,Yes,14,0,0,3,0,0,0,0,0,,,,1995-02-09T10:35:00Z,1995-02-09T10:50:00Z
Ocean Beach,WINTER,1994,2/9/1995,12,Yes,17,0,1,3,0,0,0,0,0,,,,1995-02-09T10:50:00Z,1995-02-09T11:00:00Z
Ocean Beach,WINTER,1994,2/9/1995,13,No,11,1,2,2,0,0,0,0,0,,,,1995-02-09T11:00:00Z,1995-02-09T11:10:00Z
Ocean Beach,WINTER,1994,2/9/1995,14,No,5,0,0,0,0,0,0,0,0,,,,1995-02-09T11:10:00Z,1995-02-09T11:15:00Z
Ocean Beach,WINTER,1994,2/11/1995,1,No,15,0,0,0,0,0,0,1,0,2 kayaks,,,1995-02-11T14:44:00Z,1995-02-11T14:50:00Z
Ocean Beach,WINTER,1994,2/11/1995,2,No,69,0,0,9,0,0,0,0,0,4 fishermen,,,1995-02-11T14:32:00Z,1995-02-11T14:44:00Z
Ocean Beach,WINTER,1994,2/11/1995,3,No,29,0,0,4,0,0,0,0,0,5 surfrs(not counted,,,1995-02-11T14:24:00Z,1995-02-11T14:32:00Z
Ocean Beach,WINTER,1994,2/11/1995,4,Yes,48,1,2,8,0,0,0,0,0,2surfrs(ncntd)7kites,,,1995-02-11T14:20:00Z,1995-02-11T14:24:00Z
Ocean Beach,WINTER,1994,2/11/1995,5,Yes,28,0,2,7,0,0,0,0,0,,,,1995-02-11T13:53:00Z,1995-02-11T14:20:00Z
Ocean Beach,WINTER,1994,2/11/1995,6,Yes,25,1,3,10,1,0,0,0,0,,,,1995-02-11T13:36:00Z,1995-02-11T13:53:00Z
Ocean Beach,WINTER,1994,2/11/1995,7,Yes,11,0,0,4,0,0,0,0,0,,,,1995-02-11T13:25:00Z,1995-02-11T13:36:00Z
Ocean Beach,WINTER,1994,2/11/1995,8,Yes,36,1,3,1,0,0,0,0,0,,,,1995-02-11T13:26:00Z,1995-02-11T13:58:00Z
Ocean Beach,WINTER,1994,2/11/1995,9,Yes,45,0,15,0,0,0,0,0,0,erroneous DUvsDR???,,,1995-02-11T13:58:00Z,1995-02-11T14:20:00Z
Ocean Beach,WINTER,1994,2/11/1995,10,Yes,28,0,4,0,0,0,0,0,0,erroneous DUvsDR???,,,1995-02-11T14:20:00Z,1995-02-11T14:35:00Z
Ocean Beach,WINTER,1994,2/11/1995,11,Yes,30,0,5,0,0,0,0,0,0,erroneous DUvsDR???,,,1995-02-11T14:35:00Z,1995-02-11T14:45:00Z
Ocean Beach,WINTER,1994,2/11/1995,12,Yes,37,3,6,0,0,0,0,0,0,erroneous DUvsDR???,,,1995-02-11T14:45:00Z,1995-02-11T14:55:00Z
Ocean Beach,WINTER,1994,2/11/1995,13,No,12,0,2,0,0,0,0,0,0,erroneous DUvsDR???,,,1995-02-11T14:55:00Z,1995-02-11T15:03:00Z
Ocean Beach,WINTER,1994,2/11/1995,14,No,10,0,2,0,0,0,0,0,0,erroneous DUvsDR???,,,1995-02-11T15:03:00Z,1995-02-11T15:15:00Z
Ocean Beach,WINTER,1994,2/14/1995,1,No,8,0,0,0,0,0,0,0,0,,,,1995-02-14T11:35:00Z,1995-02-14T11:40:00Z
Ocean Beach,WINTER,1994,2/14/1995,2,No,11,0,0,4,1,0,0,0,0,,,,1995-02-14T11:20:00Z,1995-02-14T11:35:00Z
Ocean Beach,WINTER,1994,2/14/1995,3,No,6,0,2,1,0,0,0,0,0,,,,1995-02-14T11:10:00Z,1995-02-14T11:20:00Z
Ocean Beach,WINTER,1994,2/14/1995,4,Yes,25,0,1,1,0,0,0,0,0,,,,1995-02-14T10:55:00Z,1995-02-14T11:10:00Z
Ocean Beach,WINTER,1994,2/14/1995,5,Yes,13,1,0,0,0,0,0,0,0,,,,1995-02-14T10:10:00Z,1995-02-14T10:55:00Z
Ocean Beach,WINTER,1994,2/14/1995,6,Yes,30,3,3,2,0,0,0,0,0,,,,1995-02-14T09:40:00Z,1995-02-14T10:10:00Z
Ocean Beach,WINTER,1994,2/14/1995,7,Yes,19,0,1,1,0,0,0,0,0,,,,1995-02-14T09:25:00Z,1995-02-14T09:40:00Z
Ocean Beach,WINTER,1994,2/14/1995,8,Yes,20,0,2,0,2,0,0,0,0,2 fishermen,,,1995-02-14T09:25:00Z,1995-02-14T09:55:00Z
Ocean Beach,WINTER,1994,2/14/1995,9,Yes,30,0,0,0,0,0,0,0,0,mostly fishrmn,,,1995-02-14T09:55:00Z,1995-02-14T10:30:00Z
Ocean Beach,WINTER,1994,2/14/1995,10,Yes,12,0,0,5,3,1,0,0,0,1 HC,,,1995-02-14T10:30:00Z,1995-02-14T10:45:00Z
Ocean Beach,WINTER,1994,2/14/1995,11,Yes,5,1,0,0,0,0,0,0,0,,,,1995-02-14T10:45:00Z,1995-02-14T11:00:00Z
Ocean Beach,WINTER,1994,2/14/1995,12,Yes,1,0,0,1,0,0,0,0,0,,,,1995-02-14T11:00:00Z,1995-02-14T11:08:00Z
Ocean Beach,WINTER,1994,2/14/1995,13,No,8,0,2,3,0,0,0,0,0,hardly any beach,,,1995-02-14T11:08:00Z,1995-02-14T11:20:00Z
Ocean Beach,WINTER,1994,2/14/1995,14,No,2,0,0,1,0,0,0,0,0,,,,1995-02-14T11:20:00Z,1995-02-14T11:30:00Z
Ocean Beach,WINTER,1994,2/18/1995,1,No,115,0,0,0,0,0,0,0,0,,,,1995-02-18T15:30:00Z,1995-02-18T15:40:00Z
Ocean Beach,WINTER,1994,2/18/1995,2,No,57,1,2,0,0,0,0,0,0,,,,1995-02-18T15:15:00Z,1995-02-18T15:30:00Z
Ocean Beach,WINTER,1994,2/18/1995,3,No,70,2,7,1,0,0,0,0,0,,,,1995-02-18T15:00:00Z,1995-02-18T15:15:00Z
Ocean Beach,WINTER,1994,2/18/1995,4,Yes,90,5,1,6,0,0,0,0,0,erroneous DUvsDR???,,,1995-02-18T14:40:00Z,1995-02-18T15:00:00Z
Ocean Beach,WINTER,1994,2/18/1995,5,Yes,60,1,6,0,0,0,0,0,0,erroneous DUvsDR???,,,1995-02-18T14:10:00Z,1995-02-18T14:40:00Z
Ocean Beach,WINTER,1994,2/18/1995,6,Yes,93,2,0,1,0,0,0,0,0,,,,1995-02-18T13:55:00Z,1995-02-18T14:10:00Z
Ocean Beach,WINTER,1994,2/18/1995,7,Yes,34,2,1,0,0,0,0,1,0,,,,1995-02-18T13:35:00Z,1995-02-18T13:55:00Z
Ocean Beach,WINTER,1994,2/18/1995,8,Yes,62,1,4,7,2,0,0,0,0,,,,1995-02-18T13:20:00Z,1995-02-18T14:05:00Z
Ocean Beach,WINTER,1994,2/18/1995,9,Yes,54,0,4,3,0,0,0,0,0,,,,1995-02-18T14:05:00Z,1995-02-18T14:45:00Z
Ocean Beach,WINTER,1994,2/18/1995,10,Yes,33,0,1,1,1,0,0,0,0,,,,1995-02-18T14:45:00Z,1995-02-18T15:00:00Z
Ocean Beach,WINTER,1994,2/18/1995,11,Yes,48,2,1,6,1,0,0,0,0,,,,1995-02-18T15:00:00Z,1995-02-18T15:15:00Z
Ocean Beach,WINTER,1994,2/18/1995,12,Yes,43,0,1,0,1,0,0,0,0,,,,1995-02-18T15:15:00Z,1995-02-18T15:21:00Z
Ocean Beach,WINTER,1994,2/18/1995,13,No,80,1,4,4,1,0,0,0,0,,,,1995-02-18T15:21:00Z,1995-02-18T15:30:00Z
Ocean Beach,WINTER,1994,2/18/1995,14,No,13,0,0,1,0,0,0,0,0,,,,1995-02-18T15:30:00Z,1995-02-18T15:40:00Z
Ocean Beach,WINTER,1994,2/22/1995,1,No,4,0,0,2,0,0,0,0,0,,,,1995-02-22T11:05:00Z,1995-02-22T11:10:00Z
Ocean Beach,WINTER,1994,2/22/1995,2,No,10,0,1,4,2,0,0,0,0,,,,1995-02-22T10:53:00Z,1995-02-22T11:05:00Z
Ocean Beach,WINTER,1994,2/22/1995,3,No,9,0,0,1,0,0,0,0,0,,,,1995-02-22T10:42:00Z,1995-02-22T10:53:00Z
Ocean Beach,WINTER,1994,2/22/1995,4,Yes,33,1,1,8,0,0,0,0,0,same golf cart,,,1995-02-22T10:24:00Z,1995-02-22T10:42:00Z
Ocean Beach,WINTER,1994,2/22/1995,5,Yes,11,0,1,0,0,0,0,0,0,same ranger truck,,,1995-02-22T10:04:00Z,1995-02-22T10:24:00Z
Ocean Beach,WINTER,1994,2/22/1995,6,Yes,14,0,0,1,0,0,0,0,2,"1 truck,1 golf cart",,,1995-02-22T09:42:00Z,1995-02-22T10:04:00Z
Ocean Beach,WINTER,1994,2/22/1995,7,Yes,18,0,1,8,1,0,1,0,0,DR dist plover,,,1995-02-22T09:25:00Z,1995-02-22T09:42:00Z
Ocean Beach,WINTER,1994,2/22/1995,8,Yes,13,0,0,3,0,0,0,0,0,,,,1995-02-22T09:25:00Z,1995-02-22T09:55:00Z
Ocean Beach,WINTER,1994,2/22/1995,9,Yes,19,0,1,2,1,0,0,0,0,1 ranger truck,,,1995-02-22T09:55:00Z,1995-02-22T10:10:00Z
Ocean Beach,WINTER,1994,2/22/1995,10,Yes,11,2,0,1,1,0,0,0,0,,,,1995-02-22T10:10:00Z,1995-02-22T10:30:00Z
Ocean Beach,WINTER,1994,2/22/1995,11,Yes,14,0,0,0,1,1,1,0,0,,,,1995-02-22T10:30:00Z,1995-02-22T10:45:00Z
Ocean Beach,WINTER,1994,2/22/1995,12,Yes,7,0,0,0,0,0,0,0,0,,,,1995-02-22T10:45:00Z,1995-02-22T10:54:00Z
Ocean Beach,WINTER,1994,2/22/1995,13,No,4,0,1,0,0,0,0,0,0,,,,1995-02-22T10:54:00Z,1995-02-22T11:05:00Z
Ocean Beach,WINTER,1994,2/22/1995,14,No,6,0,2,4,0,0,0,0,0,,,,1995-02-22T11:05:00Z,1995-02-22T11:10:00Z
Ocean Beach,WINTER,1994,2/25/1995,1,No,44,1,1,1,0,0,0,0,0,c=gull,,,1995-02-25T14:40:00Z,1995-02-25T14:45:00Z
Ocean Beach,WINTER,1994,2/25/1995,2,No,107,1,0,2,0,0,0,0,0,1metl dtectr truck,,,1995-02-25T14:30:00Z,1995-02-25T14:40:00Z
Ocean Beach,WINTER,1994,2/25/1995,3,No,82,1,2,6,0,0,0,0,0,8 passes by res vh,,,1995-02-25T14:15:00Z,1995-02-25T14:30:00Z
Ocean Beach,WINTER,1994,2/25/1995,4,Yes,137,3,1,5,1,0,0,0,1,metl dtectr vh-resrc,,,1995-02-25T13:55:00Z,1995-02-25T14:15:00Z
Ocean Beach,WINTER,1994,2/25/1995,5,Yes,27,1,1,4,0,0,0,0,0,,,,1995-02-25T13:45:00Z,1995-02-25T13:55:00Z
Ocean Beach,WINTER,1994,2/25/1995,6,Yes,20,1,1,3,0,0,0,1,0,,,,1995-02-25T13:30:00Z,1995-02-25T13:45:00Z
Ocean Beach,WINTER,1994,2/25/1995,7,Yes,43,1,2,12,1,0,0,0,0,,,,1995-02-25T13:15:00Z,1995-02-25T13:30:00Z
Ocean Beach,WINTER,1994,2/25/1995,8,Yes,19,0,0,5,2,0,0,0,0,"25surfers(nc),1hc",,,1995-02-25T13:15:00Z,1995-02-25T13:30:00Z
Ocean Beach,WINTER,1994,2/25/1995,9,Yes,38,0,0,11,2,0,0,0,0,"18surfers,2fishers",,,1995-02-25T13:30:00Z,1995-02-25T14:00:00Z
Ocean Beach,WINTER,1994,2/25/1995,10,Yes,28,0,2,1,0,0,0,0,0,7surfers-not counted,,,1995-02-25T14:00:00Z,1995-02-25T14:12:00Z
Ocean Beach,WINTER,1994,2/25/1995,11,Yes,13,0,0,0,0,0,0,0,0,8surfers-not counted,,,1995-02-25T14:12:00Z,1995-02-25T14:25:00Z
Ocean Beach,WINTER,1994,2/25/1995,12,Yes,60,0,2,7,0,0,0,0,0,"11surfers, 2 kites",,,1995-02-25T14:25:00Z,1995-02-25T14:35:00Z
Ocean Beach,WINTER,1994,2/25/1995,13,No,75,2,0,8,0,0,0,0,0,22 surfers,,,1995-02-25T14:35:00Z,1995-02-25T14:45:00Z
Ocean Beach,WINTER,1994,2/25/1995,14,No,17,1,3,4,0,0,0,0,0,"8surfers, 2fishers",,,1995-02-25T14:45:00Z,1995-02-25T14:45:00Z
Ocean Beach,WINTER,1994,2/28/1995,1,No,3,0,0,0,0,0,0,0,0,,,,1995-02-28T11:10:00Z,1995-02-28T11:15:00Z
Ocean Beach,WINTER,1994,2/28/1995,2,No,8,1,1,3,0,0,0,0,0,,,,1995-02-28T11:00:00Z,1995-02-28T11:10:00Z
Ocean Beach,WINTER,1994,2/28/1995,3,No,4,0,0,1,0,0,0,0,0,,,,1995-02-28T10:51:00Z,1995-02-28T11:00:00Z
Ocean Beach,WINTER,1994,2/28/1995,4,Yes,7,0,0,4,0,0,0,0,0,,,,1995-02-28T10:33:00Z,1995-02-28T10:51:00Z
Ocean Beach,WINTER,1994,2/28/1995,5,Yes,4,0,0,0,0,0,0,0,0,,,,1995-02-28T10:10:00Z,1995-02-28T10:33:00Z
Ocean Beach,WINTER,1994,2/28/1995,6,Yes,6,1,4,0,0,0,0,0,0,,,,1995-02-28T09:52:00Z,1995-02-28T10:10:00Z
Ocean Beach,WINTER,1994,2/28/1995,7,Yes,6,1,0,0,0,0,0,0,0,,,,1995-02-28T09:40:00Z,1995-02-28T09:52:00Z
Ocean Beach,WINTER,1994,2/28/1995,8,Yes,8,0,0,1,0,0,0,0,0,DR flushed plover,,,1995-02-28T09:50:00Z,1995-02-28T10:00:00Z
Ocean Beach,WINTER,1994,2/28/1995,9,Yes,7,0,0,4,0,0,8,0,0,"DR,hman flush plvrs",,,1995-02-28T10:00:00Z,1995-02-28T10:35:00Z
Ocean Beach,WINTER,1994,2/28/1995,10,Yes,2,0,0,1,0,0,0,0,0,,,,1995-02-28T10:35:00Z,1995-02-28T10:55:00Z
Ocean Beach,WINTER,1994,2/28/1995,11,Yes,2,0,2,1,0,0,0,0,0,,,,1995-02-28T10:55:00Z,1995-02-28T11:10:00Z
Ocean Beach,WINTER,1994,2/28/1995,12,Yes,0,0,0,0,0,0,0,0,0,,,,1995-02-28T11:10:00Z,1995-02-28T11:20:00Z
Ocean Beach,SPRING,1994,3/4/1995,1,No,21,0,0,0,0,0,0,0,0,,,,1995-03-04T14:45:00Z,1995-03-04T14:45:00Z
Ocean Beach,SPRING,1994,3/4/1995,2,No,58,0,1,4,0,0,0,0,0,,,,1995-03-04T14:40:00Z,1995-03-04T14:45:00Z
Ocean Beach,SPRING,1994,3/4/1995,3,No,52,0,6,0,0,0,0,0,0,"1bik,1whlchair,2fris",,,1995-03-04T14:18:00Z,1995-03-04T14:40:00Z
Ocean Beach,SPRING,1994,3/4/1995,4,Yes,66,0,3,5,0,0,0,0,0,"3 bikes, 1 kite",,,1995-03-04T14:10:00Z,1995-03-04T14:18:00Z
Ocean Beach,SPRING,1994,3/4/1995,5,Yes,71,0,2,2,0,0,0,0,0,,,,1995-03-04T13:57:00Z,1995-03-04T14:10:00Z
Ocean Beach,SPRING,1994,3/4/1995,6,Yes,29,0,0,2,0,0,0,0,0,,,,1995-03-04T13:42:00Z,1995-03-04T13:57:00Z
Ocean Beach,SPRING,1994,3/4/1995,7,Yes,17,0,2,2,0,0,0,0,0,,,,1995-03-04T13:35:00Z,1995-03-04T13:42:00Z
Ocean Beach,SPRING,1994,3/4/1995,8,Yes,21,0,4,0,2,0,0,0,2,2 motorcycles,,,1995-03-04T13:38:00Z,1995-03-04T14:02:00Z
Ocean Beach,SPRING,1994,3/4/1995,9,Yes,37,2,0,5,0,0,0,0,0,football game,,,1995-03-04T14:02:00Z,1995-03-04T14:31:00Z
Ocean Beach,SPRING,1994,3/4/1995,10,Yes,14,0,0,3,0,0,0,2,0,,,,1995-03-04T14:31:00Z,1995-03-04T14:46:00Z
Ocean Beach,SPRING,1994,3/4/1995,11,Yes,20,0,5,0,0,0,0,0,0,,,,1995-03-04T14:46:00Z,1995-03-04T15:00:00Z
Ocean Beach,SPRING,1994,3/4/1995,12,Yes,13,0,1,1,0,0,0,0,0,2 frisbee,,,1995-03-04T15:00:00Z,1995-03-04T15:07:00Z
Ocean Beach,SPRING,1994,3/4/1995,13,No,34,1,1,2,0,0,0,0,0,,,,1995-03-04T15:07:00Z,1995-03-04T15:15:00Z
Ocean Beach,SPRING,1994,3/4/1995,14,No,15,0,1,2,0,0,0,0,0,,,,1995-03-04T15:15:00Z,1995-03-04T15:25:00Z
Ocean Beach,SPRING,1994,3/11/1995,1,No,12,0,0,1,1,0,0,0,0,2 bikes,,,1995-03-11T15:00:00Z,1995-03-11T15:05:00Z
Ocean Beach,SPRING,1994,3/11/1995,2,No,16,0,1,0,0,0,0,0,0,,,,1995-03-11T14:48:00Z,1995-03-11T15:00:00Z
Ocean Beach,SPRING,1994,3/11/1995,3,No,12,0,1,0,0,0,0,0,0,,,,1995-03-11T14:40:00Z,1995-03-11T14:48:00Z
Ocean Beach,SPRING,1994,3/11/1995,4,Yes,30,1,0,0,0,0,0,0,0,1 kite,,,1995-03-11T14:25:00Z,1995-03-11T14:40:00Z
Ocean Beach,SPRING,1994,3/11/1995,5,Yes,10,1,2,4,3,1,0,0,0,people/dgs dbl count,,,1995-03-11T14:00:00Z,1995-03-11T14:25:00Z
Ocean Beach,SPRING,1994,3/11/1995,6,Yes,10,0,0,0,0,0,0,0,0,sect 6-4=best guess,,,1995-03-11T13:45:00Z,1995-03-11T14:00:00Z
Ocean Beach,SPRING,1994,3/11/1995,7,Yes,9,0,1,0,0,0,0,0,0,,,,1995-03-11T13:30:00Z,1995-03-11T13:45:00Z
Ocean Beach,SPRING,1994,3/11/1995,8,Yes,14,0,1,2,0,0,0,0,0,,,,1995-03-11T13:25:00Z,1995-03-11T13:55:00Z
Ocean Beach,SPRING,1994,3/11/1995,9,Yes,35,1,3,4,4,0,0,0,0,,,,1995-03-11T13:55:00Z,1995-03-11T14:15:00Z
Ocean Beach,SPRING,1994,3/11/1995,10,Yes,26,0,1,7,0,0,0,0,0,,,,1995-03-11T14:15:00Z,1995-03-11T14:35:00Z
Ocean Beach,SPRING,1994,3/11/1995,11,Yes,10,0,0,4,0,0,0,0,0,1 kite,,,1995-03-11T14:35:00Z,1995-03-11T14:50:00Z
Ocean Beach,SPRING,1994,3/11/1995,12,Yes,17,0,1,1,0,0,0,0,0,,,,1995-03-11T14:50:00Z,1995-03-11T14:56:00Z
Ocean Beach,SPRING,1994,3/11/1995,13,No,31,0,0,2,0,0,0,0,0,,,,1995-03-11T14:56:00Z,1995-03-11T15:15:00Z
Ocean Beach,SPRING,1994,3/11/1995,14,No,5,0,1,0,0,0,0,0,0,,,,1995-03-11T15:15:00Z,1995-03-11T15:15:00Z
Ocean Beach,SPRING,1994,3/14/1995,1,No,1,0,0,1,0,0,0,0,0,,,,1995-03-14T10:45:00Z,1995-03-14T10:50:00Z
Ocean Beach,SPRING,1994,3/14/1995,2,No,6,0,3,0,0,0,0,0,0,,,,1995-03-14T10:36:00Z,1995-03-14T10:45:00Z
Ocean Beach,SPRING,1994,3/14/1995,3,No,2,0,0,2,0,0,0,0,0,,,,1995-03-14T10:30:00Z,1995-03-14T10:36:00Z
Ocean Beach,SPRING,1994,3/14/1995,4,Yes,4,1,0,0,1,0,0,0,0,,,,1995-03-14T10:15:00Z,1995-03-14T10:30:00Z
Ocean Beach,SPRING,1994,3/14/1995,5,Yes,8,0,0,2,0,0,0,0,0,,,,1995-03-14T10:10:00Z,1995-03-14T10:15:00Z
Ocean Beach,SPRING,1994,3/14/1995,6,Yes,5,0,1,3,0,0,0,0,0,,,,1995-03-14T09:40:00Z,1995-03-14T10:10:00Z
Ocean Beach,SPRING,1994,3/14/1995,7,Yes,30,0,1,3,1,0,0,0,0,,,,1995-03-14T09:20:00Z,1995-03-14T09:40:00Z
Ocean Beach,SPRING,1994,3/14/1995,8,Yes,14,0,1,1,1,0,0,0,0,mostly fishrmn,,,1995-03-14T09:30:00Z,1995-03-14T09:46:00Z
Ocean Beach,SPRING,1994,3/14/1995,9,Yes,15,0,2,3,0,0,0,0,0,,,,1995-03-14T09:46:00Z,1995-03-14T10:11:00Z
Ocean Beach,SPRING,1994,3/14/1995,10,Yes,2,0,0,1,0,0,0,0,0,,,,1995-03-14T10:11:00Z,1995-03-14T10:24:00Z
Ocean Beach,SPRING,1994,3/14/1995,11,Yes,20,0,1,2,0,0,0,0,0,students/class,,,1995-03-14T10:24:00Z,1995-03-14T10:35:00Z
Ocean Beach,SPRING,1994,3/14/1995,12,Yes,19,0,1,1,1,0,0,0,0,class,,,1995-03-14T10:35:00Z,1995-03-14T10:55:00Z
Ocean Beach,SPRING,1994,3/14/1995,13,No,0,0,0,0,0,0,0,0,0,not surveyed,,,1995-03-14T10:55:00Z,1995-03-14T10:55:00Z
Ocean Beach,SPRING,1994,3/14/1995,14,No,0,0,0,0,0,0,0,0,0,not surveyed,,,1995-03-14T10:55:00Z,1995-03-14T10:55:00Z
Ocean Beach,SPRING,1994,3/18/1995,1,No,15,0,0,2,0,0,0,0,0,,,,1995-03-18T14:55:00Z,1995-03-18T14:55:00Z
Ocean Beach,SPRING,1994,3/18/1995,2,No,22,0,0,0,0,0,0,0,0,,,,1995-03-18T14:47:00Z,1995-03-18T14:55:00Z
Ocean Beach,SPRING,1994,3/18/1995,3,No,42,0,2,3,0,0,0,0,0,dead sea lion,,,1995-03-18T14:40:00Z,1995-03-18T14:47:00Z
Ocean Beach,SPRING,1994,3/18/1995,4,Yes,30,0,0,1,0,0,0,0,0,,,,1995-03-18T14:22:00Z,1995-03-18T14:40:00Z
Ocean Beach,SPRING,1994,3/18/1995,5,Yes,30,0,1,1,0,0,0,0,0,1 kite,,,1995-03-18T14:05:00Z,1995-03-18T14:22:00Z
Ocean Beach,SPRING,1994,3/18/1995,6,Yes,23,0,0,3,0,0,0,0,0,,,,1995-03-18T13:55:00Z,1995-03-18T14:05:00Z
Ocean Beach,SPRING,1994,3/18/1995,7,Yes,33,0,1,4,0,0,0,0,0,dead dog,,,1995-03-18T13:35:00Z,1995-03-18T13:55:00Z
Ocean Beach,SPRING,1994,3/18/1995,8,Yes,19,0,2,4,0,0,0,0,0,mostly fishermen,,,1995-03-18T13:50:00Z,1995-03-18T14:12:00Z
Ocean Beach,SPRING,1994,3/18/1995,9,Yes,20,0,1,1,0,0,0,0,0,mostly fishermen,,,1995-03-18T13:45:00Z,1995-03-18T13:50:00Z
Ocean Beach,SPRING,1994,3/18/1995,10,Yes,14,1,0,4,0,0,0,0,0,,,,1995-03-18T14:12:00Z,1995-03-18T14:24:00Z
Ocean Beach,SPRING,1994,3/18/1995,11,Yes,2,0,0,0,1,0,0,0,0,,,,1995-03-18T14:24:00Z,1995-03-18T14:35:00Z
Ocean Beach,SPRING,1994,3/18/1995,12,Yes,27,3,1,0,1,0,0,0,0,,,,1995-03-18T14:35:00Z,1995-03-18T14:45:00Z
Ocean Beach,SPRING,1994,3/18/1995,13,No,25,0,0,1,0,0,0,0,0,little beach,,,1995-03-18T14:45:00Z,1995-03-18T14:52:00Z
Ocean Beach,SPRING,1994,3/18/1995,14,No,18,0,0,5,0,0,0,0,0,mostly fishermen,,,1995-03-18T14:52:00Z,1995-03-18T15:00:00Z
Ocean Beach,SPRING,1994,3/22/1995,1,No,0,0,0,0,0,0,0,0,0,rain,,,1995-03-22T10:48:00Z,1995-03-22T11:00:00Z
Ocean Beach,SPRING,1994,3/22/1995,2,No,0,0,0,0,0,0,0,0,0,rain-not aborted,,,1995-03-22T10:42:00Z,1995-03-22T10:48:00Z
Ocean Beach,SPRING,1994,3/22/1995,3,No,3,0,0,0,0,0,0,0,0,,,,1995-03-22T10:30:00Z,1995-03-22T10:42:00Z
Ocean Beach,SPRING,1994,3/22/1995,4,Yes,4,0,0,0,0,0,0,0,0,,,,1995-03-22T10:18:00Z,1995-03-22T10:30:00Z
Ocean Beach,SPRING,1994,3/22/1995,5,Yes,2,0,0,0,0,0,0,0,0,,,,1995-03-22T09:54:00Z,1995-03-22T10:18:00Z
Ocean Beach,SPRING,1994,3/22/1995,6,Yes,1,0,0,1,0,0,0,0,0,,,,1995-03-22T09:38:00Z,1995-03-22T09:54:00Z
Ocean Beach,SPRING,1994,3/22/1995,7,Yes,1,0,0,0,0,0,0,0,0,,,,1995-03-22T09:30:00Z,1995-03-22T09:38:00Z
Ocean Beach,SPRING,1994,3/22/1995,8,Yes,4,0,1,0,0,0,0,0,0,,,,1995-03-22T09:30:00Z,1995-03-22T09:50:00Z
Ocean Beach,SPRING,1994,3/22/1995,9,Yes,1,0,0,0,0,0,0,0,0,,,,1995-03-22T09:50:00Z,1995-03-22T10:05:00Z
Ocean Beach,SPRING,1994,3/22/1995,10,Yes,1,0,0,0,0,0,0,0,0,,,,1995-03-22T10:05:00Z,1995-03-22T10:25:00Z
Ocean Beach,SPRING,1994,3/22/1995,11,Yes,2,0,1,2,0,0,0,0,1,"bulldozer, rain",,,1995-03-22T10:25:00Z,1995-03-22T10:35:00Z
Ocean Beach,SPRING,1994,3/22/1995,12,Yes,3,0,0,0,0,0,0,0,0,rain,,,1995-03-22T10:35:00Z,1995-03-22T10:45:00Z
Ocean Beach,SPRING,1994,3/22/1995,13,No,1,0,0,0,0,0,0,0,0,rain,,,1995-03-22T10:45:00Z,1995-03-22T11:00:00Z
Ocean Beach,SPRING,1994,3/22/1995,14,No,0,0,0,0,0,0,0,0,0,rain,,,1995-03-22T11:00:00Z,1995-03-22T11:00:00Z
Ocean Beach,SPRING,1994,3/25/1995,1,No,78,0,0,3,0,0,0,0,0,,,,1995-03-25T14:20:00Z,1995-03-25T14:30:00Z
Ocean Beach,SPRING,1994,3/25/1995,2,No,65,0,0,1,0,0,0,0,0,3surfers-not counted,,,1995-03-25T14:12:00Z,1995-03-25T14:20:00Z
Ocean Beach,SPRING,1994,3/25/1995,3,No,450,0,0,5,0,0,0,0,0,soccer tournament,,,1995-03-25T14:03:00Z,1995-03-25T14:12:00Z
Ocean Beach,SPRING,1994,3/25/1995,4,Yes,103,1,1,11,0,0,0,0,0,"22surfers,1 kite",,,1995-03-25T13:55:00Z,1995-03-25T14:03:00Z
Ocean Beach,SPRING,1994,3/25/1995,5,Yes,73,1,0,12,1,0,0,0,0,"3surfers,1 kite",,,1995-03-25T13:48:00Z,1995-03-25T13:55:00Z
Ocean Beach,SPRING,1994,3/25/1995,6,Yes,62,1,0,8,0,0,0,0,0,,,,1995-03-25T13:42:00Z,1995-03-25T13:48:00Z
Ocean Beach,SPRING,1994,3/25/1995,7,Yes,47,1,0,6,0,0,0,0,0,,,,1995-03-25T13:35:00Z,1995-03-25T13:42:00Z
Ocean Beach,SPRING,1994,3/25/1995,8,Yes,50,2,11,6,0,0,0,0,0,"sm aircraft,1 bike",,,1995-03-25T13:40:00Z,1995-03-25T14:00:00Z
Ocean Beach,SPRING,1994,3/25/1995,9,Yes,40,2,0,0,0,0,0,1,0,"1bike,horsmn",,,1995-03-25T14:00:00Z,1995-03-25T14:15:00Z
Ocean Beach,SPRING,1994,3/25/1995,10,Yes,32,1,4,2,0,0,0,0,0,sm aircraft,,,1995-03-25T14:15:00Z,1995-03-25T14:20:00Z
Ocean Beach,SPRING,1994,3/25/1995,11,Yes,54,1,4,3,1,0,0,0,0,,,,1995-03-25T14:20:00Z,1995-03-25T14:25:00Z
Ocean Beach,SPRING,1994,3/25/1995,12,Yes,107,1,2,1,0,0,0,0,0,1 kite,,,1995-03-25T14:25:00Z,1995-03-25T14:35:00Z
Ocean Beach,SPRING,1994,3/25/1995,13,No,86,0,3,1,0,0,0,0,0,,,,1995-03-25T14:35:00Z,1995-03-25T14:45:00Z
Ocean Beach,SPRING,1994,3/25/1995,14,No,41,0,6,1,0,0,0,0,0,,,,1995-03-25T14:45:00Z,1995-03-25T14:50:00Z
Ocean Beach,SPRING,1994,3/28/1995,1,No,9,0,0,2,0,0,0,0,0,,,,1995-03-28T10:34:00Z,1995-03-28T10:40:00Z
Ocean Beach,SPRING,1994,3/28/1995,2,No,34,0,0,1,0,0,0,0,0,,,,1995-03-28T10:21:00Z,1995-03-28T10:34:00Z
Ocean Beach,SPRING,1994,3/28/1995,3,No,38,0,0,1,0,0,0,0,0,,,,1995-03-28T10:10:00Z,1995-03-28T10:21:00Z
Ocean Beach,SPRING,1994,3/28/1995,4,Yes,24,0,0,2,0,0,0,0,0,,,,1995-03-28T09:57:00Z,1995-03-28T10:10:00Z
Ocean Beach,SPRING,1994,3/28/1995,5,Yes,20,0,0,2,0,0,0,0,0,,,,1995-03-28T09:44:00Z,1995-03-28T09:57:00Z
Ocean Beach,SPRING,1994,3/28/1995,6,Yes,11,0,1,2,0,0,0,0,0,,,,1995-03-28T09:32:00Z,1995-03-28T09:44:00Z
Ocean Beach,SPRING,1994,3/28/1995,7,Yes,9,0,0,0,0,0,0,0,0,,,,1995-03-28T09:20:00Z,1995-03-28T09:32:00Z
Ocean Beach,SPRING,1994,3/28/1995,8,Yes,23,0,2,0,0,0,0,0,0,erroneous DUvsDR???,,,1995-03-28T09:30:00Z,1995-03-28T09:40:00Z
Ocean Beach,SPRING,1994,3/28/1995,9,Yes,18,3,3,1,0,0,0,0,0,ditto,,,1995-03-28T09:40:00Z,1995-03-28T10:10:00Z
Ocean Beach,SPRING,1994,3/28/1995,10,Yes,11,0,4,0,0,0,0,0,0,ditto,,,1995-03-28T10:10:00Z,1995-03-28T10:20:00Z
Ocean Beach,SPRING,1994,3/28/1995,11,Yes,9,0,11,0,0,0,0,0,0,ditto,,,1995-03-28T10:20:00Z,1995-03-28T10:35:00Z
Ocean Beach,SPRING,1994,3/28/1995,12,Yes,8,0,0,0,0,0,0,0,0,ditto,,,1995-03-28T10:35:00Z,1995-03-28T10:50:00Z
Ocean Beach,SPRING,1994,3/28/1995,13,No,14,0,20,0,0,0,0,0,0,ditto,,,1995-03-28T10:50:00Z,1995-03-28T11:05:00Z
Ocean Beach,SPRING,1994,3/28/1995,14,No,1,0,0,0,0,0,0,0,0,ditto,,,1995-03-28T11:05:00Z,1995-03-28T11:05:00Z
Ocean Beach,SPRING,1994,4/1/1995,8,Yes,13,0,0,0,0,0,0,0,0,,,,1995-04-01T13:20:00Z,1995-04-01T13:38:00Z
Ocean Beach,SPRING,1994,4/1/1995,9,Yes,4,2,0,1,2,0,0,0,0,,,,1995-04-01T13:38:00Z,1995-04-01T13:56:00Z
Ocean Beach,SPRING,1994,4/1/1995,10,Yes,4,0,0,0,0,0,0,0,0,,,,1995-04-01T13:56:00Z,1995-04-01T14:01:00Z
Ocean Beach,SPRING,1994,4/1/1995,11,Yes,19,4,1,2,0,0,0,0,0,,,,1995-04-01T14:01:00Z,1995-04-01T14:09:00Z
Ocean Beach,SPRING,1994,4/1/1995,12,Yes,21,0,0,2,0,0,0,0,0,,,,1995-04-01T14:09:00Z,1995-04-01T14:15:00Z
Ocean Beach,SPRING,1994,4/1/1995,13,No,24,0,0,0,0,0,0,0,0,,,,1995-04-01T14:15:00Z,1995-04-01T14:22:00Z
Ocean Beach,SPRING,1994,4/1/1995,14,No,2,0,0,0,0,0,0,0,0,,,,1995-04-01T14:22:00Z,1995-04-01T14:25:00Z
Ocean Beach,SPRING,1994,4/5/1995,1,No,3,0,0,3,0,0,0,0,0,,,,1995-04-05T10:24:00Z,1995-04-05T10:30:00Z
Ocean Beach,SPRING,1994,4/5/1995,2,No,8,0,0,1,0,0,0,0,0,,,,1995-04-05T10:14:00Z,1995-04-05T10:24:00Z
Ocean Beach,SPRING,1994,4/5/1995,3,No,11,0,0,0,0,0,0,0,0,,,,1995-04-05T10:06:00Z,1995-04-05T10:14:00Z
Ocean Beach,SPRING,1994,4/5/1995,4,Yes,24,1,0,2,0,0,0,0,0,,,,1995-04-05T09:51:00Z,1995-04-05T10:06:00Z
Ocean Beach,SPRING,1994,4/5/1995,5,Yes,8,0,0,0,0,0,0,0,0,,,,1995-04-05T09:37:00Z,1995-04-05T09:51:00Z
Ocean Beach,SPRING,1994,4/5/1995,6,Yes,7,0,0,7,0,0,0,0,0,,,,1995-04-05T09:25:00Z,1995-04-05T09:37:00Z
Ocean Beach,SPRING,1994,4/5/1995,7,Yes,12,0,0,3,0,0,0,0,0,,,,1995-04-05T09:16:00Z,1995-04-05T09:25:00Z
Ocean Beach,SPRING,1994,4/5/1995,8,Yes,12,0,2,2,0,0,0,0,0,,,,1995-04-05T09:20:00Z,1995-04-05T09:45:00Z
Ocean Beach,SPRING,1994,4/5/1995,9,Yes,13,0,1,0,1,0,4,0,0,DUorDC dist 4 snpl,,,1995-04-05T09:45:00Z,1995-04-05T10:00:00Z
Ocean Beach,SPRING,1994,4/5/1995,10,Yes,7,0,0,3,0,0,0,0,0,,,,1995-04-05T10:00:00Z,1995-04-05T10:13:00Z
Ocean Beach,SPRING,1994,4/5/1995,11,Yes,5,0,0,1,0,0,0,0,0,,,,1995-04-05T10:13:00Z,1995-04-05T10:25:00Z
Ocean Beach,SPRING,1994,4/5/1995,12,Yes,43,0,0,2,0,0,0,0,0,,,,1995-04-05T10:25:00Z,1995-04-05T10:32:00Z
Ocean Beach,SPRING,1994,4/5/1995,13,No,6,0,0,3,0,0,0,0,0,,,,1995-04-05T10:32:00Z,1995-04-05T10:42:00Z
Ocean Beach,SPRING,1994,4/5/1995,14,No,6,0,1,3,0,0,0,0,0,,,,1995-04-05T10:42:00Z,1995-04-05T10:50:00Z
Ocean Beach,SPRING,1994,4/8/1995,1,No,7,0,0,0,0,0,0,0,0,,,,1995-04-08T14:41:00Z,1995-04-08T14:45:00Z
Ocean Beach,SPRING,1994,4/8/1995,2,No,12,0,1,2,0,0,0,0,0,,,,1995-04-08T14:32:00Z,1995-04-08T14:41:00Z
Ocean Beach,SPRING,1994,4/8/1995,3,No,13,2,2,2,0,0,0,0,0,rain,,,1995-04-08T14:07:00Z,1995-04-08T14:32:00Z
Ocean Beach,SPRING,1994,4/8/1995,4,Yes,20,1,1,5,0,0,0,0,0,,,,1995-04-08T13:53:00Z,1995-04-08T14:07:00Z
Ocean Beach,SPRING,1994,4/8/1995,5,Yes,25,1,3,3,0,0,0,0,0,,,,1995-04-08T13:42:00Z,1995-04-08T13:53:00Z
Ocean Beach,SPRING,1994,4/8/1995,6,Yes,9,0,0,0,1,0,0,0,0,,,,1995-04-08T13:35:00Z,1995-04-08T13:42:00Z
Ocean Beach,SPRING,1994,4/8/1995,7,Yes,12,1,1,0,0,0,0,0,0,,,,1995-04-08T13:25:00Z,1995-04-08T13:35:00Z
Ocean Beach,SPRING,1994,4/8/1995,8,Yes,36,1,3,4,0,0,0,0,0,,,,1995-04-08T13:17:00Z,1995-04-08T13:50:00Z
Ocean Beach,SPRING,1994,4/8/1995,9,Yes,10,0,0,3,1,0,0,0,0,,,,1995-04-08T13:50:00Z,1995-04-08T14:07:00Z
Ocean Beach,SPRING,1994,4/8/1995,10,Yes,15,0,0,2,0,0,0,0,0,rain,,,1995-04-08T14:07:00Z,1995-04-08T14:15:00Z
Ocean Beach,SPRING,1994,4/11/1995,1,No,15,0,0,0,0,0,0,0,0,,,,1995-04-11T10:23:00Z,1995-04-11T10:25:00Z
Ocean Beach,SPRING,1994,4/11/1995,2,No,16,0,6,0,0,0,0,0,0,,,,1995-04-11T10:14:00Z,1995-04-11T10:23:00Z
Ocean Beach,SPRING,1994,4/11/1995,3,No,6,0,0,0,0,0,0,0,0,,,,1995-04-11T10:05:00Z,1995-04-11T10:14:00Z
Ocean Beach,SPRING,1994,4/11/1995,4,Yes,5,0,2,0,0,0,0,0,0,,,,1995-04-11T10:00:00Z,1995-04-11T10:05:00Z
Ocean Beach,SPRING,1994,4/11/1995,5,Yes,6,0,0,0,0,0,0,0,0,,,,1995-04-11T09:55:00Z,1995-04-11T10:00:00Z
Ocean Beach,SPRING,1994,4/11/1995,6,Yes,6,0,1,0,0,0,0,0,0,,,,1995-04-11T09:42:00Z,1995-04-11T09:55:00Z
Ocean Beach,SPRING,1994,4/11/1995,7,Yes,19,0,8,0,0,0,0,0,0,all fishermen,,,1995-04-11T09:25:00Z,1995-04-11T09:42:00Z
Ocean Beach,SPRING,1994,4/11/1995,8,Yes,19,0,4,1,0,0,0,0,0,,,,1995-04-11T09:25:00Z,1995-04-11T09:40:00Z
Ocean Beach,SPRING,1994,4/11/1995,9,Yes,5,0,0,0,0,0,0,0,0,,,,1995-04-11T09:40:00Z,1995-04-11T09:54:00Z
Ocean Beach,SPRING,1994,4/11/1995,10,Yes,6,1,0,0,0,0,0,0,0,2 pelicans,,,1995-04-11T09:54:00Z,1995-04-11T10:08:00Z
Ocean Beach,SPRING,1994,4/11/1995,11,Yes,3,0,1,1,0,0,0,0,0,3 terns,,,1995-04-11T10:08:00Z,1995-04-11T10:18:00Z
Ocean Beach,SPRING,1994,4/11/1995,12,Yes,10,0,0,1,0,0,0,0,0,,,,1995-04-11T10:18:00Z,1995-04-11T10:24:00Z
Ocean Beach,SPRING,1994,4/11/1995,13,No,9,0,2,3,1,0,0,0,0,,,,1995-04-11T10:24:00Z,1995-04-11T10:35:00Z
Ocean Beach,SPRING,1994,4/11/1995,14,No,7,0,0,1,1,0,0,0,0,2 playing soccer,,,1995-04-11T10:35:00Z,1995-04-11T10:45:00Z
Ocean Beach,SPRING,1994,4/15/1995,4,Yes,3,0,0,0,0,0,0,0,0,X aborted rain,,,,
Ocean Beach,SPRING,1994,4/15/1995,5,Yes,9,0,0,0,1,0,0,0,0,,,,1995-04-15T13:45:00Z,1995-04-15T13:55:00Z
Ocean Beach,SPRING,1994,4/15/1995,6,Yes,11,0,0,0,1,0,0,0,0,,,,1995-04-15T13:32:00Z,1995-04-15T13:45:00Z
Ocean Beach,SPRING,1994,4/15/1995,7,Yes,11,0,0,1,0,0,0,0,0,,,,1995-04-15T13:20:00Z,1995-04-15T13:32:00Z
Ocean Beach,SPRING,1994,4/15/1995,8,Yes,9,0,0,0,1,0,0,0,0,,,,1995-04-15T13:15:00Z,1995-04-15T13:32:00Z
Ocean Beach,SPRING,1994,4/15/1995,9,Yes,3,0,0,0,0,0,0,0,0,,,,1995-04-15T13:32:00Z,1995-04-15T13:42:00Z
Ocean Beach,SPRING,1994,4/15/1995,10,Yes,10,0,0,3,0,0,0,0,0,started to rain,,,1995-04-15T13:42:00Z,1995-04-15T13:52:00Z
Ocean Beach,SPRING,1994,4/19/1995,1,No,10,0,1,0,0,0,0,0,0,3 brown pelicans,,,1995-04-19T10:48:00Z,1995-04-19T10:55:00Z
Ocean Beach,SPRING,1994,4/19/1995,2,No,16,0,0,0,0,0,0,0,0,common mure dead,,,1995-04-19T10:32:00Z,1995-04-19T10:48:00Z
Ocean Beach,SPRING,1994,4/19/1995,3,No,7,0,0,0,0,0,0,0,0,,,,1995-04-19T10:17:00Z,1995-04-19T10:32:00Z
Ocean Beach,SPRING,1994,4/19/1995,4,Yes,14,1,1,1,0,0,0,0,0,,,,1995-04-19T09:58:00Z,1995-04-19T10:17:00Z
Ocean Beach,SPRING,1994,4/19/1995,5,Yes,12,1,1,2,0,0,0,0,0,,,,1995-04-19T09:45:00Z,1995-04-19T09:58:00Z
Ocean Beach,SPRING,1994,4/19/1995,6,Yes,6,1,0,0,1,0,0,0,0,1 killdeer,,,1995-04-19T09:35:00Z,1995-04-19T09:45:00Z
Ocean Beach,SPRING,1994,4/19/1995,7,Yes,5,0,0,0,0,0,0,0,0,"not rec'd,11h in sc6",,,1995-04-19T09:25:00Z,1995-04-19T09:35:00Z
Ocean Beach,SPRING,1994,4/19/1995,8,Yes,2,0,0,1,0,0,0,0,0,,,,1995-04-19T09:25:00Z,1995-04-19T09:35:00Z
Ocean Beach,SPRING,1994,4/19/1995,9,Yes,10,1,0,1,1,0,0,0,0,,,,1995-04-19T09:35:00Z,1995-04-19T09:50:00Z
Ocean Beach,SPRING,1994,4/19/1995,10,Yes,5,0,0,1,0,0,0,0,0,,,,1995-04-19T09:50:00Z,1995-04-19T10:00:00Z
Ocean Beach,SPRING,1994,4/19/1995,11,Yes,2,0,0,0,0,0,0,0,0,,,,1995-04-19T10:00:00Z,1995-04-19T10:12:00Z
Ocean Beach,SPRING,1994,4/19/1995,12,Yes,5,0,0,0,0,0,0,0,0,,,,1995-04-19T10:12:00Z,1995-04-19T10:20:00Z
Ocean Beach,SPRING,1994,4/19/1995,13,No,9,0,0,5,0,0,0,0,0,,,,1995-04-19T10:20:00Z,1995-04-19T10:25:00Z
Ocean Beach,SPRING,1994,4/19/1995,14,No,1,1,0,0,0,0,0,0,0,,,,1995-04-19T10:25:00Z,1995-04-19T10:35:00Z
Ocean Beach,SPRING,1994,4/22/1995,1,No,76,1,3,0,0,0,0,0,0,,,,1995-04-22T14:25:00Z,1995-04-22T14:30:00Z
Ocean Beach,SPRING,1994,4/22/1995,2,No,194,0,3,4,0,0,0,0,0,,,,1995-04-22T14:15:00Z,1995-04-22T14:25:00Z
Ocean Beach,SPRING,1994,4/22/1995,3,No,269,1,0,3,0,0,0,0,0,,,,1995-04-22T14:05:00Z,1995-04-22T14:15:00Z
Ocean Beach,SPRING,1994,4/22/1995,4,Yes,393,2,1,4,0,0,0,0,0,,,,1995-04-22T13:55:00Z,1995-04-22T14:05:00Z
Ocean Beach,SPRING,1994,4/22/1995,5,Yes,180,2,3,11,0,0,0,0,0,,,,1995-04-22T13:45:00Z,1995-04-22T13:55:00Z
Ocean Beach,SPRING,1994,4/22/1995,6,Yes,145,1,5,2,0,0,0,0,0,,,,1995-04-22T13:35:00Z,1995-04-22T13:45:00Z
Ocean Beach,SPRING,1994,4/22/1995,7,Yes,70,1,1,1,0,0,0,0,0,6 playing volleyball,,,1995-04-22T13:30:00Z,1995-04-22T13:35:00Z
Ocean Beach,SPRING,1994,4/22/1995,8,Yes,55,0,2,2,1,0,0,0,0,,,,1995-04-22T13:30:00Z,1995-04-22T13:50:00Z
Ocean Beach,SPRING,1994,4/22/1995,9,Yes,30,1,0,0,0,0,0,0,0,,,,1995-04-22T13:50:00Z,1995-04-22T14:13:00Z
Ocean Beach,SPRING,1994,4/22/1995,10,Yes,60,0,3,1,0,0,0,0,0,,,,1995-04-22T14:13:00Z,1995-04-22T14:24:00Z
Ocean Beach,SPRING,1994,4/22/1995,11,Yes,80,1,2,6,0,0,0,0,0,volleyball game,,,1995-04-22T14:24:00Z,1995-04-22T14:35:00Z
Ocean Beach,SPRING,1994,4/22/1995,12,Yes,100,1,2,0,0,0,0,0,0,12 surfers,,,1995-04-22T14:35:00Z,1995-04-22T14:45:00Z
Ocean Beach,SPRING,1994,4/22/1995,13,No,186,0,11,4,0,0,0,0,0,kites,,,1995-04-22T14:45:00Z,1995-04-22T15:00:00Z
Ocean Beach,SPRING,1994,4/22/1995,14,No,160,0,2,1,0,0,0,2,1,"fire,4dune buggy",,,1995-04-22T15:00:00Z,1995-04-22T15:30:00Z
Ocean Beach,SPRING,1994,4/25/1995,1,No,0,0,0,0,0,0,0,0,0,,,,1995-04-25T10:26:00Z,1995-04-25T10:30:00Z
Ocean Beach,SPRING,1994,4/25/1995,2,No,10,0,0,0,0,0,0,0,0,,,,1995-04-25T10:18:00Z,1995-04-25T10:26:00Z
Ocean Beach,SPRING,1994,4/25/1995,3,No,11,0,0,0,0,0,0,0,0,,,,1995-04-25T10:11:00Z,1995-04-25T10:18:00Z
Ocean Beach,SPRING,1994,4/25/1995,4,Yes,0,0,0,0,0,0,0,0,0,,,,1995-04-25T10:00:00Z,1995-04-25T10:11:00Z
Ocean Beach,SPRING,1994,4/25/1995,5,Yes,4,0,0,0,0,0,0,0,0,,,,1995-04-25T09:55:00Z,1995-04-25T10:00:00Z
Ocean Beach,SPRING,1994,4/25/1995,6,Yes,2,0,0,0,0,0,0,0,0,,,,1995-04-25T09:30:00Z,1995-04-25T09:55:00Z
Ocean Beach,SPRING,1994,4/25/1995,7,Yes,10,0,1,3,1,0,0,0,0,,,,1995-04-25T09:20:00Z,1995-04-25T09:30:00Z
Ocean Beach,SPRING,1994,4/25/1995,8,Yes,3,0,0,0,0,0,0,0,0,,,,1995-04-25T09:20:00Z,1995-04-25T09:45:00Z
Ocean Beach,SPRING,1994,4/25/1995,9,Yes,5,0,0,1,0,0,0,0,0,,,,1995-04-25T09:45:00Z,1995-04-25T10:08:00Z
Ocean Beach,SPRING,1994,4/25/1995,10,Yes,2,0,1,0,0,0,0,0,0,,,,1995-04-25T10:08:00Z,1995-04-25T10:23:00Z
Ocean Beach,SPRING,1994,4/25/1995,11,Yes,3,0,0,0,0,0,0,0,0,,,,1995-04-25T10:23:00Z,1995-04-25T10:42:00Z
Ocean Beach,SPRING,1994,4/25/1995,12,Yes,3,0,0,0,0,0,0,0,0,,,,1995-04-25T10:42:00Z,1995-04-25T10:54:00Z
Ocean Beach,SPRING,1994,4/25/1995,13,No,3,0,0,0,0,0,0,0,0,,,,1995-04-25T10:54:00Z,1995-04-25T11:05:00Z
Ocean Beach,SPRING,1994,4/25/1995,14,No,47,0,0,0,0,0,0,0,0,school group,,,1995-04-25T11:05:00Z,1995-04-25T11:15:00Z
Ocean Beach,SPRING,1994,4/29/1995,1,No,2,0,0,0,0,0,0,0,0,,,,1995-04-29T14:43:00Z,1995-04-29T14:45:00Z
Ocean Beach,SPRING,1994,4/29/1995,2,No,8,0,0,0,0,0,0,0,0,,,,1995-04-29T14:34:00Z,1995-04-29T14:43:00Z
Ocean Beach,SPRING,1994,4/29/1995,3,No,21,0,0,1,0,0,0,0,0,"1 kite,8 fishermen",,,1995-04-29T14:25:00Z,1995-04-29T14:34:00Z
Ocean Beach,SPRING,1994,4/29/1995,4,Yes,25,0,2,1,0,0,0,0,0,1 dead scoter,,,1995-04-29T14:09:00Z,1995-04-29T14:25:00Z
Ocean Beach,SPRING,1994,4/29/1995,5,Yes,10,1,0,0,0,0,0,0,0,,,,1995-04-29T13:51:00Z,1995-04-29T14:09:00Z
Ocean Beach,SPRING,1994,4/29/1995,6,Yes,7,0,0,1,0,0,0,0,0,,,,1995-04-29T13:37:00Z,1995-04-29T13:51:00Z
Ocean Beach,SPRING,1994,4/29/1995,7,Yes,3,0,0,2,0,0,0,0,0,,,,1995-04-29T13:25:00Z,1995-04-29T13:37:00Z
Ocean Beach,SPRING,1994,4/29/1995,8,Yes,5,0,1,0,0,0,0,0,0,,,,1995-04-29T13:25:00Z,1995-04-29T13:38:00Z
Ocean Beach,SPRING,1994,4/29/1995,9,Yes,1,0,0,0,0,0,0,0,0,,,,1995-04-29T13:38:00Z,1995-04-29T13:52:00Z
Ocean Beach,SPRING,1994,4/29/1995,10,Yes,3,0,0,0,0,0,0,0,0,,,,1995-04-29T13:52:00Z,1995-04-29T14:06:00Z
Ocean Beach,SPRING,1994,4/29/1995,11,Yes,6,0,1,0,1,0,0,0,0,,,,1995-04-29T14:06:00Z,1995-04-29T14:26:00Z
Ocean Beach,SPRING,1994,4/29/1995,12,Yes,12,1,0,0,0,0,0,0,0,,,,1995-04-29T14:26:00Z,1995-04-29T14:35:00Z
Ocean Beach,SPRING,1994,4/29/1995,13,No,10,0,7,1,0,0,0,0,0,,,,1995-04-29T14:35:00Z,1995-04-29T14:40:00Z
Ocean Beach,SPRING,1994,4/29/1995,14,No,4,0,1,2,0,0,0,0,0,,,,1995-04-29T14:40:00Z,1995-04-29T14:50:00Z
Ocean Beach,SPRING,1994,5/3/1995,8,Yes,23,1,3,4,0,0,0,0,0,,,,1995-05-03T09:45:00Z,1995-05-03T09:55:00Z
Ocean Beach,SPRING,1994,5/3/1995,9,Yes,11,0,0,2,1,0,0,0,0,,,,1995-05-03T09:55:00Z,1995-05-03T10:10:00Z
Ocean Beach,SPRING,1994,5/3/1995,10,Yes,7,1,3,0,0,0,0,0,0,,,,1995-05-03T10:10:00Z,1995-05-03T10:26:00Z
Ocean Beach,SPRING,1994,5/3/1995,11,Yes,9,0,1,1,0,0,0,0,0,1 osprey fly w/fish,,,1995-05-03T10:26:00Z,1995-05-03T10:37:00Z
Ocean Beach,SPRING,1994,5/3/1995,12,Yes,97,0,1,3,0,0,0,0,0,"6fishrmn,school kids",,,1995-05-03T10:37:00Z,1995-05-03T10:45:00Z
Ocean Beach,SPRING,1994,5/3/1995,13,No,17,0,2,3,0,0,0,0,0,5fishrmn,,,1995-05-03T10:45:00Z,1995-05-03T10:55:00Z
Ocean Beach,SPRING,1994,5/3/1995,14,No,14,1,9,6,0,0,0,0,0,,,,1995-05-03T10:55:00Z,1995-05-03T11:00:00Z
Ocean Beach,SPRING,1994,5/6/1995,1,No,60,0,0,2,0,0,0,0,0,,,,1995-05-06T14:30:00Z,1995-05-06T14:30:00Z
Ocean Beach,SPRING,1994,5/6/1995,2,No,60,0,0,4,0,0,0,0,0,,,,1995-05-06T14:20:00Z,1995-05-06T14:30:00Z
Ocean Beach,SPRING,1994,5/6/1995,3,No,80,0,2,1,0,0,0,0,0,,,,1995-05-06T14:10:00Z,1995-05-06T14:20:00Z
Ocean Beach,SPRING,1994,5/6/1995,4,Yes,50,0,1,1,0,0,0,0,0,,,,1995-05-06T14:00:00Z,1995-05-06T14:10:00Z
Ocean Beach,SPRING,1994,5/6/1995,5,Yes,60,1,2,0,1,0,0,0,0,,,,1995-05-06T13:50:00Z,1995-05-06T14:00:00Z
Ocean Beach,SPRING,1994,5/6/1995,6,Yes,65,2,4,0,0,0,0,0,0,,,,1995-05-06T13:45:00Z,1995-05-06T13:50:00Z
Ocean Beach,SPRING,1994,5/6/1995,7,Yes,18,1,2,2,0,0,0,0,0,,,,1995-05-06T13:38:00Z,1995-05-06T13:45:00Z
Ocean Beach,SPRING,1994,5/6/1995,8,Yes,70,0,4,15,0,0,0,0,0,,,,1995-05-06T13:20:00Z,1995-05-06T13:40:00Z
Ocean Beach,SPRING,1994,5/6/1995,9,Yes,39,1,1,7,0,0,0,1,0,,,,1995-05-06T13:40:00Z,1995-05-06T14:10:00Z
Ocean Beach,SPRING,1994,5/6/1995,10,Yes,40,0,0,4,0,0,0,0,0,,,,1995-05-06T14:10:00Z,1995-05-06T14:29:00Z
Ocean Beach,SPRING,1994,5/6/1995,11,Yes,60,0,1,2,0,0,0,0,0,,,,1995-05-06T14:29:00Z,1995-05-06T14:43:00Z
Ocean Beach,SPRING,1994,5/6/1995,12,Yes,78,1,0,4,0,0,0,0,0,2 kites,,,1995-05-06T14:43:00Z,1995-05-06T14:56:00Z
Ocean Beach,SPRING,1994,5/6/1995,13,No,41,0,0,5,0,0,0,0,0,,,,1995-05-06T14:56:00Z,1995-05-06T15:03:00Z
Ocean Beach,SPRING,1994,5/6/1995,14,No,0,0,0,0,0,0,0,0,0,,,,1995-05-06T15:03:00Z,1995-05-06T15:10:00Z
Ocean Beach,SPRING,1994,5/9/1995,1,No,4,0,0,0,0,0,0,0,0,,,,1995-05-09T11:03:00Z,1995-05-09T11:05:00Z
Ocean Beach,SPRING,1994,5/9/1995,2,No,25,0,2,0,0,0,0,0,0,hman incl  14srfers,,,1995-05-09T10:48:00Z,1995-05-09T11:03:00Z
Ocean Beach,SPRING,1994,5/9/1995,3,No,26,0,0,2,0,0,0,0,0,hman incl 5 srfers??,,,1995-05-09T10:33:00Z,1995-05-09T10:48:00Z
Ocean Beach,SPRING,1994,5/9/1995,4,Yes,10,0,0,0,4,0,0,0,0,,,,1995-05-09T10:12:00Z,1995-05-09T10:33:00Z
Ocean Beach,SPRING,1994,5/9/1995,5,Yes,16,0,0,2,0,0,0,0,0,,,,1995-05-09T10:05:00Z,1995-05-09T10:12:00Z
Ocean Beach,SPRING,1994,5/9/1995,6,Yes,5,0,0,0,0,0,0,0,0,,,,1995-05-09T09:50:00Z,1995-05-09T10:05:00Z
Ocean Beach,SPRING,1994,5/9/1995,7,Yes,10,0,0,1,0,0,0,0,0,,,,1995-05-09T09:30:00Z,1995-05-09T09:50:00Z
Ocean Beach,SPRING,1994,5/9/1995,8,Yes,6,0,0,0,1,0,0,0,0,,,,1995-05-09T09:25:00Z,1995-05-09T09:40:00Z
Ocean Beach,SPRING,1994,5/9/1995,9,Yes,8,0,1,0,0,0,0,0,0,,,,1995-05-09T09:40:00Z,1995-05-09T10:10:00Z
Ocean Beach,SPRING,1994,5/9/1995,10,Yes,3,0,0,1,0,0,0,0,0,,,,1995-05-09T10:10:00Z,1995-05-09T10:20:00Z
Ocean Beach,SPRING,1994,5/9/1995,11,Yes,2,0,1,1,0,0,0,0,0,,,,1995-05-09T10:20:00Z,1995-05-09T10:45:00Z
Ocean Beach,SPRING,1994,5/9/1995,12,Yes,2,0,1,1,0,0,0,0,0,,,,1995-05-09T10:45:00Z,1995-05-09T10:50:00Z
Ocean Beach,SPRING,1994,5/9/1995,13,No,5,0,9,0,1,0,0,0,0,,,,1995-05-09T10:50:00Z,1995-05-09T11:05:00Z
Ocean Beach,SPRING,1994,5/9/1995,14,No,1,0,0,0,0,0,0,0,0,,,,1995-05-09T11:05:00Z,1995-05-09T11:15:00Z
Ocean Beach,SPRING,1994,5/13/1995,1,No,18,0,0,1,0,0,0,0,0,,,,1995-05-13T14:05:00Z,1995-05-13T14:10:00Z
Ocean Beach,SPRING,1994,5/13/1995,2,No,23,2,0,2,0,0,0,0,0,,,,1995-05-13T13:58:00Z,1995-05-13T14:05:00Z
Ocean Beach,SPRING,1994,5/13/1995,3,No,33,0,2,3,0,0,0,0,0,,,,1995-05-13T13:51:00Z,1995-05-13T13:58:00Z
Ocean Beach,SPRING,1994,5/13/1995,4,Yes,22,2,1,5,0,0,0,0,0,,,,1995-05-13T13:40:00Z,1995-05-13T13:51:00Z
Ocean Beach,SPRING,1994,5/13/1995,5,Yes,10,0,0,4,0,0,0,0,0,,,,1995-05-13T13:31:00Z,1995-05-13T13:40:00Z
Ocean Beach,SPRING,1994,5/13/1995,6,Yes,7,0,0,1,0,0,0,0,0,,,,1995-05-13T13:23:00Z,1995-05-13T13:31:00Z
Ocean Beach,SPRING,1994,5/13/1995,7,Yes,8,0,0,1,0,0,0,0,0,,,,1995-05-13T13:12:00Z,1995-05-13T13:23:00Z
Ocean Beach,SPRING,1994,5/13/1995,8,Yes,6,0,2,2,0,0,0,0,0,,,,1995-05-13T13:15:00Z,1995-05-13T13:25:00Z
Ocean Beach,SPRING,1994,5/13/1995,9,Yes,14,1,1,1,0,0,0,0,0,,,,1995-05-13T13:25:00Z,1995-05-13T13:50:00Z
Ocean Beach,SPRING,1994,5/13/1995,10,Yes,16,0,1,3,0,0,0,0,0,,,,1995-05-13T13:50:00Z,1995-05-13T14:00:00Z
Ocean Beach,SPRING,1994,5/13/1995,11,Yes,5,0,0,2,0,0,0,0,0,,,,1995-05-13T14:00:00Z,1995-05-13T14:10:00Z
Ocean Beach,SPRING,1994,5/13/1995,12,Yes,10,0,4,1,0,0,0,0,0,,,,1995-05-13T14:10:00Z,1995-05-13T14:18:00Z
Ocean Beach,SPRING,1994,5/13/1995,13,No,0,0,0,3,0,0,0,0,0,,,,1995-05-13T14:18:00Z,1995-05-13T14:25:00Z
Ocean Beach,SPRING,1994,5/13/1995,14,No,0,0,0,0,0,0,0,0,0,,,,1995-05-13T14:25:00Z,1995-05-13T14:35:00Z
Ocean Beach,SPRING,1994,5/17/1995,5,Yes,7,0,0,0,1,0,0,0,0,,,,1995-05-17T10:44:00Z,1995-05-17T10:59:00Z
Ocean Beach,SPRING,1994,5/17/1995,6,Yes,8,0,0,0,0,0,0,0,0,,,,1995-05-17T10:36:00Z,1995-05-17T10:44:00Z
Ocean Beach,SPRING,1994,5/17/1995,7,Yes,7,1,0,0,1,0,0,0,0,,,,1995-05-17T10:28:00Z,1995-05-17T10:36:00Z
Ocean Beach,SPRING,1994,5/17/1995,8,Yes,5,0,0,1,0,0,0,0,0,,,,1995-05-17T09:24:00Z,1995-05-17T09:40:00Z
Ocean Beach,SPRING,1994,5/17/1995,9,Yes,3,0,0,0,1,0,0,0,0,,,,1995-05-17T09:40:00Z,1995-05-17T09:54:00Z
Ocean Beach,SPRING,1994,5/17/1995,10,Yes,39,0,0,1,0,0,0,0,0,,,,1995-05-17T09:54:00Z,1995-05-17T10:05:00Z
Ocean Beach,FALL,1995,7/19/1995,1,No,31,1,0,0,0,0,0,0,0,"16 fishrmn,7surfers",,,1995-07-19T11:30:00Z,1995-07-19T11:36:00Z
Ocean Beach,FALL,1995,7/19/1995,2,No,13,0,1,0,0,0,0,0,0,,,,1995-07-19T11:20:00Z,1995-07-19T11:30:00Z
Ocean Beach,FALL,1995,7/19/1995,3,No,15,0,1,2,0,0,0,0,0,sand/plowed rows,,,1995-07-19T11:12:00Z,1995-07-19T11:20:00Z
Ocean Beach,FALL,1995,7/19/1995,4,Yes,80,0,1,2,0,0,0,0,0,"4fishrmn,kid group",,,1995-07-19T11:00:00Z,1995-07-19T11:12:00Z
Ocean Beach,FALL,1995,7/19/1995,5,Yes,17,0,1,1,0,0,0,0,0,,,,1995-07-19T10:45:00Z,1995-07-19T11:00:00Z
Ocean Beach,FALL,1995,7/19/1995,6,Yes,11,2,0,0,0,0,0,0,0,,,,1995-07-19T10:25:00Z,1995-07-19T10:45:00Z
Ocean Beach,FALL,1995,7/19/1995,7,Yes,28,5,8,1,0,0,0,0,0,"1heli,6fishrmn",,,1995-07-19T09:49:00Z,1995-07-19T10:25:00Z
Ocean Beach,FALL,1995,7/19/1995,8,Yes,10,2,3,0,0,0,0,0,0,1 helicopter,,,1995-07-19T09:55:00Z,1995-07-19T10:16:00Z
Ocean Beach,FALL,1995,7/19/1995,9,Yes,7,0,0,3,0,0,0,0,0,,,,1995-07-19T10:16:00Z,1995-07-19T10:32:00Z
Ocean Beach,FALL,1995,7/19/1995,10,Yes,5,0,0,0,0,0,0,0,0,,,,1995-07-19T10:32:00Z,1995-07-19T10:39:00Z
Ocean Beach,FALL,1995,7/19/1995,11,Yes,2,1,1,1,0,0,0,0,0,,,,1995-07-19T10:39:00Z,1995-07-19T10:47:00Z
Ocean Beach,FALL,1995,7/19/1995,12,Yes,31,0,1,2,0,0,0,0,0,"7 fishrmn,1 fire",,,1995-07-19T10:47:00Z,1995-07-19T11:03:00Z
Ocean Beach,FALL,1995,7/19/1995,13,No,5,0,1,1,0,0,0,0,0,1 dead murre,,,1995-07-19T11:03:00Z,1995-07-19T11:10:00Z
Ocean Beach,FALL,1995,7/19/1995,14,No,3,1,0,0,0,0,0,0,0,3 fishrmn,,,1995-07-19T11:10:00Z,1995-07-19T11:30:00Z
Ocean Beach,FALL,1995,7/23/1995,1,No,79,0,1,0,0,0,0,0,0,,,,1995-07-23T14:05:00Z,1995-07-23T14:05:00Z
Ocean Beach,FALL,1995,7/23/1995,2,No,141,0,0,0,0,0,0,0,0,,,,1995-07-23T14:02:00Z,1995-07-23T14:05:00Z
Ocean Beach,FALL,1995,7/23/1995,3,No,117,0,0,0,0,0,0,0,0,,,,1995-07-23T13:46:00Z,1995-07-23T14:02:00Z
Ocean Beach,FALL,1995,7/23/1995,4,Yes,139,0,4,0,0,0,0,0,0,,,,1995-07-23T13:38:00Z,1995-07-23T13:46:00Z
Ocean Beach,FALL,1995,7/23/1995,5,Yes,49,2,1,0,0,0,0,0,0,,,,1995-07-23T13:32:00Z,1995-07-23T13:38:00Z
Ocean Beach,FALL,1995,7/23/1995,6,Yes,37,0,1,2,0,0,0,0,0,,,,1995-07-23T13:20:00Z,1995-07-23T13:32:00Z
Ocean Beach,FALL,1995,7/23/1995,7,Yes,32,0,1,1,0,0,0,0,0,"3fishrmn,1helicopter",,,1995-07-23T13:15:00Z,1995-07-23T13:20:00Z
Ocean Beach,FALL,1995,7/23/1995,8,Yes,49,0,3,2,0,0,0,0,0,"1heli,2planes",,,1995-07-23T13:32:00Z,1995-07-23T13:45:00Z
Ocean Beach,FALL,1995,7/23/1995,9,Yes,31,0,4,0,0,0,0,0,0,1plane,,,1995-07-23T13:45:00Z,1995-07-23T14:05:00Z
Ocean Beach,FALL,1995,7/23/1995,10,Yes,35,0,3,0,0,0,0,0,0,1heli,,,1995-07-23T14:05:00Z,1995-07-23T14:25:00Z
Ocean Beach,FALL,1995,7/23/1995,11,Yes,39,1,3,1,0,0,0,0,0,,,,1995-07-23T14:25:00Z,1995-07-23T14:35:00Z
Ocean Beach,FALL,1995,7/23/1995,12,Yes,67,0,4,0,0,0,0,0,0,1 kite,,,1995-07-23T14:35:00Z,1995-07-23T14:50:00Z
Ocean Beach,FALL,1995,7/23/1995,13,No,137,1,5,0,0,0,0,0,0,"2 planes, 1 kite",,,1995-07-23T14:50:00Z,1995-07-23T15:00:00Z
Ocean Beach,FALL,1995,7/23/1995,14,No,48,0,8,2,0,0,0,0,0,,,,1995-07-23T15:00:00Z,1995-07-23T15:00:00Z
Ocean Beach,FALL,1995,7/26/1995,1,No,32,0,1,0,0,0,0,0,0,,,,1995-07-26T10:43:00Z,1995-07-26T10:48:00Z
Ocean Beach,FALL,1995,7/26/1995,2,No,5,0,1,0,0,0,0,0,1,tractor working,,,1995-07-26T10:35:00Z,1995-07-26T10:43:00Z
Ocean Beach,FALL,1995,7/26/1995,3,No,25,0,1,2,1,0,0,0,0,,,,1995-07-26T10:20:00Z,1995-07-26T10:35:00Z
Ocean Beach,FALL,1995,7/26/1995,4,Yes,18,0,3,2,1,0,0,0,1,"1tractor,1bike",,,1995-07-26T10:03:00Z,1995-07-26T10:20:00Z
Ocean Beach,FALL,1995,7/26/1995,5,Yes,10,0,2,1,0,0,0,0,0,,,,1995-07-26T09:55:00Z,1995-07-26T10:03:00Z
Ocean Beach,FALL,1995,7/26/1995,6,Yes,6,0,1,0,0,0,0,0,0,,,,1995-07-26T09:45:00Z,1995-07-26T09:55:00Z
Ocean Beach,FALL,1995,7/26/1995,7,Yes,11,0,2,0,0,0,0,0,0,,,,1995-07-26T09:37:00Z,1995-07-26T09:45:00Z
Ocean Beach,FALL,1995,7/26/1995,8,Yes,13,0,1,4,0,0,0,0,0,,,,1995-07-26T09:40:00Z,1995-07-26T09:55:00Z
Ocean Beach,FALL,1995,7/26/1995,9,Yes,7,0,0,3,0,0,0,0,0,,,,1995-07-26T09:55:00Z,1995-07-26T10:15:00Z
Ocean Beach,FALL,1995,7/26/1995,10,Yes,14,0,0,6,0,0,0,0,0,,,,1995-07-26T10:15:00Z,1995-07-26T10:28:00Z
Ocean Beach,FALL,1995,7/26/1995,11,Yes,10,1,0,0,0,0,0,0,0,,,,1995-07-26T10:28:00Z,1995-07-26T10:43:00Z
Ocean Beach,FALL,1995,7/26/1995,12,Yes,15,1,0,0,0,0,0,0,0,,,,1995-07-26T10:43:00Z,1995-07-26T10:51:00Z
Ocean Beach,FALL,1995,7/26/1995,13,No,11,0,0,4,0,0,0,0,0,,,,1995-07-26T10:51:00Z,1995-07-26T10:58:00Z
Ocean Beach,FALL,1995,7/26/1995,14,No,20,1,1,3,0,0,0,0,0,1comu-dead chick,,,1995-07-26T10:58:00Z,1995-07-26T11:20:00Z
Ocean Beach,FALL,1995,7/29/1995,1,No,97,0,0,1,0,0,0,0,0,,,,1995-07-29T14:49:00Z,1995-07-29T14:55:00Z
Ocean Beach,FALL,1995,7/29/1995,2,No,168,0,0,0,0,0,0,0,0,,,,1995-07-29T14:41:00Z,1995-07-29T14:49:00Z
Ocean Beach,FALL,1995,7/29/1995,3,No,122,3,0,4,0,0,0,0,0,,,,1995-07-29T14:32:00Z,1995-07-29T14:41:00Z
Ocean Beach,FALL,1995,7/29/1995,4,Yes,117,4,0,6,0,0,0,0,0,,,,1995-07-29T14:22:00Z,1995-07-29T14:32:00Z
Ocean Beach,FALL,1995,7/29/1995,5,Yes,75,1,0,5,0,0,0,0,0,,,,1995-07-29T14:10:00Z,1995-07-29T14:22:00Z
Ocean Beach,FALL,1995,7/29/1995,6,Yes,98,2,0,0,0,0,0,0,0,,,,1995-07-29T13:59:00Z,1995-07-29T14:10:00Z
Ocean Beach,FALL,1995,7/29/1995,7,Yes,36,0,0,4,0,0,0,0,0,,,,1995-07-29T13:52:00Z,1995-07-29T13:59:00Z
Ocean Beach,FALL,1995,7/29/1995,8,Yes,11,1,2,1,0,0,0,0,0,,,,1995-07-29T13:45:00Z,1995-07-29T14:00:00Z
Ocean Beach,FALL,1995,7/29/1995,9,Yes,26,1,3,0,0,0,0,0,0,,,,1995-07-29T14:00:00Z,1995-07-29T14:10:00Z
Ocean Beach,FALL,1995,7/29/1995,10,Yes,58,0,0,3,0,0,0,2,0,,,,1995-07-29T14:10:00Z,1995-07-29T14:20:00Z
Ocean Beach,FALL,1995,7/29/1995,11,Yes,78,0,1,0,0,0,0,0,0,,,,1995-07-29T14:20:00Z,1995-07-29T14:30:00Z
Ocean Beach,FALL,1995,7/29/1995,12,Yes,31,0,2,0,0,0,0,0,0,,,,1995-07-29T14:30:00Z,1995-07-29T14:40:00Z
Ocean Beach,FALL,1995,7/29/1995,13,No,186,2,5,1,0,0,0,0,0,,,,1995-07-29T14:40:00Z,1995-07-29T14:50:00Z
Ocean Beach,FALL,1995,7/29/1995,14,No,41,1,4,0,0,0,0,0,0,,,,1995-07-29T14:50:00Z,1995-07-29T14:50:00Z
Ocean Beach,FALL,1995,8/1/1995,1,No,8,0,2,0,0,0,0,0,0,,,,1995-08-01T11:00:00Z,1995-08-01T11:10:00Z
Ocean Beach,FALL,1995,8/1/1995,2,No,30,0,7,0,0,0,0,0,0,,,,1995-08-01T10:50:00Z,1995-08-01T11:00:00Z
Ocean Beach,FALL,1995,8/1/1995,3,No,33,0,1,0,0,0,0,0,0,1dead COMU,,,1995-08-01T10:35:00Z,1995-08-01T10:50:00Z
Ocean Beach,FALL,1995,8/1/1995,4,Yes,15,1,2,3,0,0,0,0,0,,,,1995-08-01T10:10:00Z,1995-08-01T10:35:00Z
Ocean Beach,FALL,1995,8/1/1995,5,Yes,12,0,3,0,0,0,0,0,0,,,,1995-08-01T09:50:00Z,1995-08-01T10:10:00Z
Ocean Beach,FALL,1995,8/1/1995,6,Yes,7,0,1,0,0,0,0,0,0,,,,1995-08-01T09:45:00Z,1995-08-01T09:50:00Z
Ocean Beach,FALL,1995,8/1/1995,7,Yes,15,1,6,1,0,0,0,0,0,1 plane,,,1995-08-01T09:25:00Z,1995-08-01T09:45:00Z
Ocean Beach,FALL,1995,8/1/1995,8,Yes,8,0,0,4,0,0,0,0,0,,,,1995-08-01T09:26:00Z,1995-08-01T09:40:00Z
Ocean Beach,FALL,1995,8/1/1995,9,Yes,13,1,0,1,2,0,0,0,0,1DC encouraged,,,1995-08-01T09:40:00Z,1995-08-01T10:05:00Z
Ocean Beach,FALL,1995,8/1/1995,10,Yes,10,0,0,1,0,0,0,0,0,,,,1995-08-01T10:05:00Z,1995-08-01T10:22:00Z
Ocean Beach,FALL,1995,8/1/1995,11,Yes,4,0,1,1,2,0,0,0,0,,,,1995-08-01T10:22:00Z,1995-08-01T10:33:00Z
Ocean Beach,FALL,1995,8/1/1995,12,Yes,13,0,0,0,0,0,0,0,0,,,,1995-08-01T10:33:00Z,1995-08-01T10:40:00Z
Ocean Beach,FALL,1995,8/1/1995,13,No,35,0,1,0,0,0,0,0,0,1dead BRPE(juv),,,1995-08-01T10:40:00Z,1995-08-01T10:53:00Z
Ocean Beach,FALL,1995,8/1/1995,14,No,15,1,6,4,0,0,0,0,0,,,,1995-08-01T10:53:00Z,1995-08-01T11:10:00Z
Ocean Beach,FALL,1995,8/5/1995,1,No,24,0,0,2,0,0,0,0,0,,,,1995-08-05T12:58:00Z,1995-08-05T13:06:00Z
Ocean Beach,FALL,1995,8/5/1995,2,No,53,0,1,4,0,0,0,0,0,,,,1995-08-05T13:06:00Z,1995-08-05T13:18:00Z
Ocean Beach,FALL,1995,8/5/1995,3,No,87,0,2,3,0,0,0,5,0,,,,1995-08-05T13:18:00Z,1995-08-05T13:27:00Z
Ocean Beach,FALL,1995,8/5/1995,4,Yes,61,2,0,5,0,0,0,0,0,,,,1995-08-05T13:27:00Z,1995-08-05T13:38:00Z
Ocean Beach,FALL,1995,8/5/1995,5,Yes,38,0,0,1,0,0,0,0,0,,,,1995-08-05T13:38:00Z,1995-08-05T13:46:00Z
Ocean Beach,FALL,1995,8/5/1995,6,Yes,45,0,1,2,0,0,0,0,0,,,,1995-08-05T13:46:00Z,1995-08-05T13:55:00Z
Ocean Beach,FALL,1995,8/5/1995,7,Yes,28,1,0,1,0,0,0,0,0,,,,1995-08-05T13:55:00Z,1995-08-05T13:55:00Z
Ocean Beach,FALL,1995,8/5/1995,8,Yes,44,0,0,5,0,0,0,7,0,,,,1995-08-05T14:00:00Z,1995-08-05T14:28:00Z
Ocean Beach,FALL,1995,8/5/1995,9,Yes,39,1,1,2,0,0,0,0,0,,,,1995-08-05T14:28:00Z,1995-08-05T14:56:00Z
Ocean Beach,FALL,1995,8/5/1995,10,Yes,24,0,3,6,0,0,0,0,0,,,,1995-08-05T14:56:00Z,1995-08-05T15:10:00Z
Ocean Beach,FALL,1995,8/5/1995,11,Yes,19,0,0,4,0,0,0,0,0,,,,1995-08-05T15:10:00Z,1995-08-05T15:18:00Z
Ocean Beach,FALL,1995,8/5/1995,12,Yes,86,0,1,0,0,0,0,0,0,,,,1995-08-05T15:18:00Z,1995-08-05T15:26:00Z
Ocean Beach,FALL,1995,8/5/1995,13,No,105,0,1,0,0,0,0,0,0,,,,1995-08-05T15:26:00Z,1995-08-05T15:34:00Z
Ocean Beach,FALL,1995,8/5/1995,14,No,35,1,0,4,0,0,0,0,0,,,,1995-08-05T15:34:00Z,1995-08-05T15:34:00Z
Ocean Beach,FALL,1995,8/9/1995,1,No,4,0,0,0,0,0,0,0,0,,,,1995-08-09T10:26:00Z,1995-08-09T10:30:00Z
Ocean Beach,FALL,1995,8/9/1995,2,No,14,0,0,0,0,0,0,0,1,bulldozer working,,,1995-08-09T10:15:00Z,1995-08-09T10:26:00Z
Ocean Beach,FALL,1995,8/9/1995,3,No,30,0,0,2,0,0,0,0,0,4fishrmn,,,1995-08-09T10:06:00Z,1995-08-09T10:15:00Z
Ocean Beach,FALL,1995,8/9/1995,4,Yes,30,0,0,0,0,0,0,0,0,,,,1995-08-09T09:50:00Z,1995-08-09T10:06:00Z
Ocean Beach,FALL,1995,8/9/1995,5,Yes,14,0,0,1,0,0,0,0,0,1fishrmn,,,1995-08-09T09:42:00Z,1995-08-09T09:50:00Z
Ocean Beach,FALL,1995,8/9/1995,6,Yes,14,0,0,5,0,0,0,0,0,"2fishrmn,1deadCOMU",,,1995-08-09T09:35:00Z,1995-08-09T09:42:00Z
Ocean Beach,FALL,1995,8/9/1995,7,Yes,5,0,0,2,0,0,0,0,0,"2 fishrmn,1deadCOMU",,,1995-08-09T09:27:00Z,1995-08-09T09:35:00Z
Ocean Beach,FALL,1995,8/9/1995,8,Yes,16,2,5,1,0,0,0,0,0,1 fire,,,1995-08-09T09:25:00Z,1995-08-09T09:45:00Z
Ocean Beach,FALL,1995,8/9/1995,9,Yes,14,0,7,0,0,0,0,0,0,,,,1995-08-09T09:45:00Z,1995-08-09T10:00:00Z
Ocean Beach,FALL,1995,8/9/1995,10,Yes,5,0,0,0,0,0,0,0,0,,,,1995-08-09T10:00:00Z,1995-08-09T10:08:00Z
Ocean Beach,FALL,1995,8/9/1995,11,Yes,6,0,0,0,0,0,0,0,0,,,,1995-08-09T10:08:00Z,1995-08-09T10:15:00Z
Ocean Beach,FALL,1995,8/9/1995,12,Yes,2,0,1,0,0,0,0,0,0,,,,1995-08-09T10:15:00Z,1995-08-09T10:22:00Z
Ocean Beach,FALL,1995,8/9/1995,13,No,21,1,7,0,0,0,0,0,0,,,,1995-08-09T10:22:00Z,1995-08-09T10:31:00Z
Ocean Beach,FALL,1995,8/9/1995,14,No,4,0,1,0,0,0,0,0,0,,,,1995-08-09T10:31:00Z,1995-08-09T10:35:00Z
Ocean Beach,FALL,1995,8/12/1995,1,No,80,0,0,0,0,0,0,0,0,,,,1995-08-12T14:30:00Z,1995-08-12T14:45:00Z
Ocean Beach,FALL,1995,8/12/1995,2,No,90,0,1,0,0,0,0,0,0,tire tracks,,,1995-08-12T14:15:00Z,1995-08-12T14:30:00Z
Ocean Beach,FALL,1995,8/12/1995,3,No,135,0,1,2,0,0,0,0,0,"20fishrmn,deadCOMU",,,1995-08-12T14:05:00Z,1995-08-12T14:15:00Z
Ocean Beach,FALL,1995,8/12/1995,4,Yes,122,2,4,2,0,0,0,0,0,,,,1995-08-12T13:53:00Z,1995-08-12T14:05:00Z
Ocean Beach,FALL,1995,8/12/1995,5,Yes,60,0,1,6,0,0,0,0,0,,,,1995-08-12T13:40:00Z,1995-08-12T13:53:00Z
Ocean Beach,FALL,1995,8/12/1995,6,Yes,40,0,1,0,0,0,0,0,0,,,,1995-08-12T13:32:00Z,1995-08-12T13:40:00Z
Ocean Beach,FALL,1995,8/12/1995,7,Yes,23,2,3,2,0,0,0,0,0,,,,1995-08-12T13:25:00Z,1995-08-12T13:32:00Z
Ocean Beach,FALL,1995,8/12/1995,8,Yes,38,0,2,3,0,0,0,0,0,,,,1995-08-12T13:20:00Z,1995-08-12T13:44:00Z
Ocean Beach,FALL,1995,8/12/1995,9,Yes,42,0,2,4,0,0,0,0,0,1 kite,,,1995-08-12T13:44:00Z,1995-08-12T14:12:00Z
Ocean Beach,FALL,1995,8/12/1995,10,Yes,24,1,2,1,1,0,0,0,0,,,,1995-08-12T14:12:00Z,1995-08-12T14:24:00Z
Ocean Beach,FALL,1995,8/12/1995,11,Yes,18,2,0,0,0,0,0,0,0,1 kite,,,1995-08-12T14:24:00Z,1995-08-12T14:33:00Z
Ocean Beach,FALL,1995,8/12/1995,12,Yes,48,0,3,0,0,0,0,0,0,,,,1995-08-12T14:33:00Z,1995-08-12T14:39:00Z
Ocean Beach,FALL,1995,8/12/1995,13,No,100,0,1,2,0,0,0,0,0,,,,1995-08-12T14:39:00Z,1995-08-12T14:47:00Z
Ocean Beach,FALL,1995,8/12/1995,14,No,33,0,1,2,0,0,0,0,0,,,,1995-08-12T14:47:00Z,1995-08-12T14:51:00Z
Ocean Beach,FALL,1995,8/15/1995,1,No,9,0,0,0,0,0,0,0,0,,,,1995-08-15T10:36:00Z,1995-08-15T10:41:00Z
Ocean Beach,FALL,1995,8/15/1995,2,No,2,0,0,0,0,0,0,0,0,,,,1995-08-15T10:24:00Z,1995-08-15T10:36:00Z
Ocean Beach,FALL,1995,8/15/1995,3,No,7,0,0,1,1,0,0,0,0,,,,1995-08-15T10:15:00Z,1995-08-15T10:24:00Z
Ocean Beach,FALL,1995,8/15/1995,4,Yes,14,0,0,7,3,0,0,0,1,bulldozer at wall,,,1995-08-15T09:56:00Z,1995-08-15T10:15:00Z
Ocean Beach,FALL,1995,8/15/1995,5,Yes,7,0,0,0,0,0,0,0,0,,,,1995-08-15T09:38:00Z,1995-08-15T09:56:00Z
Ocean Beach,FALL,1995,8/15/1995,6,Yes,4,0,0,3,0,0,0,0,0,,,,1995-08-15T09:22:00Z,1995-08-15T09:38:00Z
Ocean Beach,FALL,1995,8/15/1995,7,Yes,13,0,1,0,0,0,0,0,0,,,,1995-08-15T09:11:00Z,1995-08-15T09:22:00Z
Ocean Beach,FALL,1995,8/15/1995,8,Yes,7,0,1,0,0,0,0,0,0,,,,1995-08-15T09:10:00Z,1995-08-15T09:30:00Z
Ocean Beach,FALL,1995,8/15/1995,9,Yes,9,0,0,2,0,0,0,0,0,,,,1995-08-15T09:30:00Z,1995-08-15T09:50:00Z
Ocean Beach,FALL,1995,8/15/1995,10,Yes,4,0,1,0,0,0,0,0,0,,,,1995-08-15T09:50:00Z,1995-08-15T10:06:00Z
Ocean Beach,FALL,1995,8/15/1995,11,Yes,3,0,0,4,0,0,0,0,0,,,,1995-08-15T10:06:00Z,1995-08-15T10:16:00Z
Ocean Beach,FALL,1995,8/15/1995,12,Yes,6,0,0,0,0,0,0,0,0,,,,1995-08-15T10:16:00Z,1995-08-15T10:25:00Z
Ocean Beach,FALL,1995,8/15/1995,13,No,7,0,0,0,0,0,0,0,0,,,,1995-08-15T10:25:00Z,1995-08-15T10:36:00Z
Ocean Beach,FALL,1995,8/15/1995,14,No,3,0,0,0,0,0,0,0,0,,,,1995-08-15T10:36:00Z,1995-08-15T10:45:00Z
Ocean Beach,FALL,1995,8/19/1995,1,No,274,0,0,1,0,1,0,0,0,,,,1995-08-19T16:29:00Z,1995-08-19T16:35:00Z
Ocean Beach,FALL,1995,8/19/1995,2,No,352,1,4,4,0,0,0,0,0,,,,1995-08-19T16:13:00Z,1995-08-19T16:29:00Z
Ocean Beach,FALL,1995,8/19/1995,3,No,350,0,2,2,0,0,0,0,0,,,,1995-08-19T16:02:00Z,1995-08-19T16:13:00Z
Ocean Beach,FALL,1995,8/19/1995,4,Yes,334,4,6,3,0,0,0,0,0,,,,1995-08-19T15:46:00Z,1995-08-19T16:02:00Z
Ocean Beach,FALL,1995,8/19/1995,5,Yes,305,0,1,6,0,0,0,1,0,,,,1995-08-19T15:35:00Z,1995-08-19T15:46:00Z
Ocean Beach,FALL,1995,8/19/1995,6,Yes,218,3,3,4,0,0,0,0,0,,,,1995-08-19T15:26:00Z,1995-08-19T15:35:00Z
Ocean Beach,FALL,1995,8/19/1995,7,Yes,126,3,0,5,0,0,0,0,0,,,,1995-08-19T15:16:00Z,1995-08-19T15:26:00Z
Ocean Beach,FALL,1995,8/19/1995,8,Yes,95,0,0,1,0,0,0,1,0,,,,1995-08-19T14:59:00Z,1995-08-19T15:16:00Z
Ocean Beach,FALL,1995,8/19/1995,9,Yes,96,1,3,4,0,0,0,0,0,,,,1995-08-19T14:21:00Z,1995-08-19T14:59:00Z
Ocean Beach,FALL,1995,8/19/1995,10,Yes,91,1,4,4,0,0,0,0,0,5 bikes,,,1995-08-19T14:09:00Z,1995-08-19T14:21:00Z
Ocean Beach,FALL,1995,8/19/1995,11,Yes,92,1,4,2,0,0,0,0,0,,,,1995-08-19T14:00:00Z,1995-08-19T14:09:00Z
Ocean Beach,FALL,1995,8/19/1995,12,Yes,160,0,2,5,0,0,0,0,0,1 bike,,,1995-08-19T13:50:00Z,1995-08-19T14:00:00Z
Ocean Beach,FALL,1995,8/19/1995,13,No,90,0,5,0,0,0,0,0,0,"1deadCOMU,1deadSUSC",,,1995-08-19T13:43:00Z,1995-08-19T13:50:00Z
Ocean Beach,FALL,1995,8/19/1995,14,No,120,0,5,0,0,0,0,0,0,3deadCOMU,,,1995-08-19T13:31:00Z,1995-08-19T13:43:00Z
Ocean Beach,FALL,1995,8/23/1995,1,No,3,0,0,0,0,0,0,0,0,,,,1995-08-23T09:56:00Z,1995-08-23T10:05:00Z
Ocean Beach,FALL,1995,8/23/1995,2,No,8,0,0,0,0,0,0,0,0,,,,1995-08-23T09:48:00Z,1995-08-23T09:56:00Z
Ocean Beach,FALL,1995,8/23/1995,3,No,6,0,0,0,0,0,0,0,0,,,,1995-08-23T09:41:00Z,1995-08-23T09:48:00Z
Ocean Beach,FALL,1995,8/23/1995,4,Yes,1,0,0,0,0,0,0,0,0,,,,1995-08-23T09:36:00Z,1995-08-23T09:41:00Z
Ocean Beach,FALL,1995,8/23/1995,5,Yes,6,0,0,0,0,0,0,0,0,,,,1995-08-23T09:27:00Z,1995-08-23T09:36:00Z
Ocean Beach,FALL,1995,8/23/1995,6,Yes,3,0,0,0,0,0,0,0,0,,,,1995-08-23T09:23:00Z,1995-08-23T09:27:00Z
Ocean Beach,FALL,1995,8/23/1995,7,Yes,7,0,0,1,0,0,0,0,0,,,,1995-08-23T09:15:00Z,1995-08-23T09:23:00Z
Ocean Beach,FALL,1995,8/23/1995,8,Yes,8,0,2,0,0,0,0,0,0,,,,1995-08-23T09:15:00Z,1995-08-23T09:44:00Z
Ocean Beach,FALL,1995,8/23/1995,9,Yes,10,0,1,4,0,0,0,0,0,playing ball w/dog,,,1995-08-23T09:44:00Z,1995-08-23T10:26:00Z
Ocean Beach,FALL,1995,8/23/1995,10,Yes,9,0,1,3,0,0,0,0,0,,,,1995-08-23T10:26:00Z,1995-08-23T10:46:00Z
Ocean Beach,FALL,1995,8/23/1995,11,Yes,5,0,0,0,0,0,0,0,0,,,,1995-08-23T10:46:00Z,1995-08-23T10:58:00Z
Ocean Beach,FALL,1995,8/23/1995,12,Yes,23,1,0,4,0,0,0,0,0,,,,1995-08-23T10:58:00Z,1995-08-23T11:06:00Z
Ocean Beach,FALL,1995,8/23/1995,13,No,14,0,0,0,0,0,0,0,0,,,,1995-08-23T11:06:00Z,1995-08-23T11:16:00Z
Ocean Beach,FALL,1995,8/23/1995,14,No,13,0,0,0,0,0,0,0,0,,,,1995-08-23T11:16:00Z,1995-08-23T11:25:00Z
Ocean Beach,FALL,1995,8/26/1995,1,No,60,1,1,3,0,0,0,0,0,"1deadCOMU,3fishrmn",,,1995-08-26T14:23:00Z,1995-08-26T14:30:00Z
Ocean Beach,FALL,1995,8/26/1995,2,No,45,0,0,4,0,0,0,0,0,"3deadCOMU,1deadgull",,,1995-08-26T14:10:00Z,1995-08-26T14:23:00Z
Ocean Beach,FALL,1995,8/26/1995,3,No,70,1,2,1,0,0,0,0,0,1 kite,,,1995-08-26T14:00:00Z,1995-08-26T14:10:00Z
Ocean Beach,FALL,1995,8/26/1995,4,Yes,70,0,0,1,0,0,0,0,0,,,,1995-08-26T13:50:00Z,1995-08-26T14:00:00Z
Ocean Beach,FALL,1995,8/26/1995,5,Yes,35,0,0,0,0,0,0,0,0,deadCOMU,,,1995-08-26T13:28:00Z,1995-08-26T13:50:00Z
Ocean Beach,FALL,1995,8/26/1995,6,Yes,26,0,0,8,0,0,0,0,0,,,,1995-08-26T13:16:00Z,1995-08-26T13:28:00Z
Ocean Beach,FALL,1995,8/26/1995,7,Yes,18,0,6,0,0,0,0,0,0,1fishrmn,,,1995-08-26T13:00:00Z,1995-08-26T13:16:00Z
Ocean Beach,FALL,1995,8/26/1995,8,Yes,31,0,2,7,0,0,0,0,0,,,,1995-08-26T13:05:00Z,1995-08-26T13:31:00Z
Ocean Beach,FALL,1995,8/26/1995,9,Yes,31,0,2,3,0,0,0,0,0,1 kite,,,1995-08-26T13:31:00Z,1995-08-26T14:11:00Z
Ocean Beach,FALL,1995,8/26/1995,10,Yes,60,2,1,1,0,0,0,0,0,,,,1995-08-26T14:11:00Z,1995-08-26T14:27:00Z
Ocean Beach,FALL,1995,8/26/1995,11,Yes,41,0,6,1,0,0,0,0,1,PP driving S/1plane,,,1995-08-26T14:27:00Z,1995-08-26T14:37:00Z
Ocean Beach,FALL,1995,8/26/1995,12,Yes,36,0,4,0,1,0,0,0,0,,,,1995-08-26T14:37:00Z,1995-08-26T14:45:00Z
Ocean Beach,FALL,1995,8/26/1995,13,No,82,0,1,2,0,0,0,0,0,,,,1995-08-26T14:45:00Z,1995-08-26T14:55:00Z
Ocean Beach,FALL,1995,8/26/1995,14,No,49,0,3,3,0,0,0,0,0,,,,1995-08-26T14:55:00Z,1995-08-26T15:04:00Z
Ocean Beach,FALL,1995,8/29/1995,1,No,6,0,0,2,0,0,0,0,0,,,,1995-08-29T11:30:00Z,1995-08-29T11:40:00Z
Ocean Beach,FALL,1995,8/29/1995,2,No,14,0,0,0,2,0,0,0,0,1 DC encouraged,,,1995-08-29T11:13:00Z,1995-08-29T11:30:00Z
Ocean Beach,FALL,1995,8/29/1995,3,No,21,0,2,0,0,0,0,0,0,,,,1995-08-29T11:03:00Z,1995-08-29T11:13:00Z
Ocean Beach,FALL,1995,8/29/1995,4,Yes,13,0,3,2,1,0,0,0,0,1 kite,,,1995-08-29T10:29:00Z,1995-08-29T11:03:00Z
Ocean Beach,FALL,1995,8/29/1995,5,Yes,10,0,2,0,0,0,0,0,0,,,,1995-08-29T10:04:00Z,1995-08-29T10:29:00Z
Ocean Beach,FALL,1995,8/29/1995,6,Yes,22,0,3,2,3,0,0,0,0,,,,1995-08-29T09:45:00Z,1995-08-29T10:04:00Z
Ocean Beach,FALL,1995,8/29/1995,7,Yes,14,0,0,0,0,0,0,0,0,,,,1995-08-29T09:21:00Z,1995-08-29T09:45:00Z
Ocean Beach,FALL,1995,8/29/1995,8,Yes,24,0,3,0,0,0,0,0,0,,,,1995-08-29T09:20:00Z,1995-08-29T10:10:00Z
Ocean Beach,FALL,1995,8/29/1995,9,Yes,22,0,5,1,0,0,0,0,0,,,,1995-08-29T10:10:00Z,1995-08-29T10:45:00Z
Ocean Beach,FALL,1995,8/29/1995,10,Yes,9,1,1,0,0,0,0,0,0,,,,1995-08-29T10:45:00Z,1995-08-29T11:00:00Z
Ocean Beach,FALL,1995,8/29/1995,11,Yes,11,1,1,0,0,0,0,0,0,,,,1995-08-29T11:00:00Z,1995-08-29T11:20:00Z
Ocean Beach,FALL,1995,8/29/1995,12,Yes,12,0,0,2,0,0,0,0,0,,,,1995-08-29T11:20:00Z,1995-08-29T11:30:00Z
Ocean Beach,FALL,1995,8/29/1995,13,No,10,0,0,0,0,0,0,0,0,,,,1995-08-29T11:30:00Z,1995-08-29T11:40:00Z
Ocean Beach,FALL,1995,8/29/1995,14,No,0,0,0,0,0,0,0,0,0,,,,1995-08-29T11:40:00Z,1995-08-29T11:40:00Z
Ocean Beach,FALL,1995,9/6/1995,1,No,8,0,1,2,0,0,0,0,0,1deadCOMU,,,1995-09-06T10:43:00Z,1995-09-06T10:55:00Z
Ocean Beach,FALL,1995,9/6/1995,2,No,24,0,0,4,0,0,0,0,0,1dead corm.,,,1995-09-06T10:32:00Z,1995-09-06T10:43:00Z
Ocean Beach,FALL,1995,9/6/1995,3,No,20,0,1,0,0,0,0,0,0,1deadCOMU,,,1995-09-06T10:20:00Z,1995-09-06T10:32:00Z
Ocean Beach,FALL,1995,9/6/1995,4,Yes,22,0,2,2,0,0,0,0,0,,,,1995-09-06T10:10:00Z,1995-09-06T10:20:00Z
Ocean Beach,FALL,1995,9/6/1995,5,Yes,24,0,1,0,1,0,0,0,0,,,,1995-09-06T09:47:00Z,1995-09-06T10:10:00Z
Ocean Beach,FALL,1995,9/6/1995,6,Yes,14,0,0,1,0,0,0,0,0,,,,1995-09-06T09:40:00Z,1995-09-06T09:47:00Z
Ocean Beach,FALL,1995,9/6/1995,7,Yes,9,1,0,0,0,0,0,0,0,,,,1995-09-06T09:30:00Z,1995-09-06T09:40:00Z
Ocean Beach,FALL,1995,9/6/1995,8,Yes,20,0,0,3,0,0,0,0,0,,,,1995-09-06T09:29:00Z,1995-09-06T09:47:00Z
Ocean Beach,FALL,1995,9/6/1995,9,Yes,6,0,0,3,0,0,0,0,0,,,,1995-09-06T09:47:00Z,1995-09-06T10:11:00Z
Ocean Beach,FALL,1995,9/6/1995,10,Yes,14,0,0,2,0,0,0,0,0,,,,1995-09-06T10:11:00Z,1995-09-06T10:24:00Z
Ocean Beach,FALL,1995,9/6/1995,11,Yes,10,0,0,0,0,0,0,0,0,,,,1995-09-06T10:24:00Z,1995-09-06T10:34:00Z
Ocean Beach,FALL,1995,9/6/1995,12,Yes,34,0,1,1,0,0,0,0,0,,,,1995-09-06T10:34:00Z,1995-09-06T10:43:00Z
Ocean Beach,FALL,1995,9/6/1995,13,No,44,1,0,4,0,0,0,0,0,,,,1995-09-06T10:43:00Z,1995-09-06T10:56:00Z
Ocean Beach,FALL,1995,9/6/1995,14,No,8,0,0,2,0,0,0,0,0,,,,1995-09-06T10:56:00Z,1995-09-06T11:08:00Z
Ocean Beach,FALL,1995,9/9/1995,1,No,39,2,2,0,0,0,0,0,0,,,,1995-09-09T14:25:00Z,1995-09-09T14:35:00Z
Ocean Beach,FALL,1995,9/9/1995,2,No,26,0,0,0,0,0,0,0,0,,,,1995-09-09T14:11:00Z,1995-09-09T14:25:00Z
Ocean Beach,FALL,1995,9/9/1995,3,No,40,0,6,0,0,0,0,0,0,,,,1995-09-09T14:04:00Z,1995-09-09T14:11:00Z
Ocean Beach,FALL,1995,9/9/1995,4,Yes,33,1,1,0,0,0,0,0,0,"2bikes,3deadCOMU",,,1995-09-09T13:48:00Z,1995-09-09T14:04:00Z
Ocean Beach,FALL,1995,9/9/1995,5,Yes,34,0,10,3,0,0,0,0,0,1deadCOMU,,,1995-09-09T13:25:00Z,1995-09-09T13:48:00Z
Ocean Beach,FALL,1995,9/9/1995,6,Yes,6,2,0,0,0,0,0,0,0,,,,1995-09-09T13:13:00Z,1995-09-09T13:25:00Z
Ocean Beach,FALL,1995,9/9/1995,7,Yes,19,0,2,0,0,0,0,0,0,"1deadCOMU,1tent camp",,,1995-09-09T13:04:00Z,1995-09-09T13:13:00Z
Ocean Beach,FALL,1995,9/9/1995,8,Yes,16,0,5,2,0,0,0,0,0,1helicopter,,,1995-09-09T13:04:00Z,1995-09-09T13:21:00Z
Ocean Beach,FALL,1995,9/9/1995,9,Yes,13,0,2,0,0,0,0,0,0,3 kites,,,1995-09-09T13:21:00Z,1995-09-09T13:43:00Z
Ocean Beach,FALL,1995,9/9/1995,10,Yes,19,0,0,0,1,0,0,0,0,"1sm.plane,1heli",,,1995-09-09T13:43:00Z,1995-09-09T13:57:00Z
Ocean Beach,FALL,1995,9/9/1995,11,Yes,14,0,3,0,2,0,0,0,0,,,,1995-09-09T13:57:00Z,1995-09-09T14:07:00Z
Ocean Beach,FALL,1995,9/9/1995,12,Yes,17,0,1,0,1,0,0,0,0,1 kite,,,1995-09-09T14:07:00Z,1995-09-09T14:16:00Z
Ocean Beach,FALL,1995,9/9/1995,13,No,23,0,2,0,0,0,0,0,0,,,,1995-09-09T14:16:00Z,1995-09-09T14:26:00Z
Ocean Beach,FALL,1995,9/9/1995,14,No,17,0,7,0,0,0,0,0,0,,,,1995-09-09T14:26:00Z,1995-09-09T14:40:00Z
Ocean Beach,FALL,1995,9/13/1995,1,No,5,0,2,0,1,0,0,0,0,,,,1995-09-13T11:25:00Z,1995-09-13T11:33:00Z
Ocean Beach,FALL,1995,9/13/1995,2,No,6,0,3,0,0,0,0,0,0,,,,1995-09-13T11:15:00Z,1995-09-13T11:25:00Z
Ocean Beach,FALL,1995,9/13/1995,3,No,5,0,1,0,0,0,0,0,0,,,,1995-09-13T11:10:00Z,1995-09-13T11:15:00Z
Ocean Beach,FALL,1995,9/13/1995,4,Yes,5,0,0,0,0,0,0,0,0,,,,1995-09-13T11:03:00Z,1995-09-13T11:10:00Z
Ocean Beach,FALL,1995,9/13/1995,5,Yes,14,0,0,7,1,0,0,0,0,,,,1995-09-13T10:38:00Z,1995-09-13T11:03:00Z
Ocean Beach,FALL,1995,9/13/1995,6,Yes,18,0,2,5,0,0,0,0,0,2 helicopters,,,1995-09-13T10:00:00Z,1995-09-13T10:38:00Z
Ocean Beach,FALL,1995,9/13/1995,7,Yes,13,0,1,0,0,0,0,0,1,Ranger driving,,,1995-09-13T09:15:00Z,1995-09-13T10:00:00Z
Ocean Beach,FALL,1995,9/13/1995,8,Yes,22,0,1,1,0,0,0,0,1,DFW vehicle,,,1995-09-13T09:15:00Z,1995-09-13T09:56:00Z
Ocean Beach,FALL,1995,9/13/1995,9,Yes,24,0,1,1,2,0,0,0,0,2 low heli,,,1995-09-13T09:56:00Z,1995-09-13T10:35:00Z
Ocean Beach,FALL,1995,9/13/1995,10,Yes,25,0,1,3,1,0,0,0,0,,,,1995-09-13T10:35:00Z,1995-09-13T11:00:00Z
Ocean Beach,FALL,1995,9/13/1995,11,Yes,3,0,1,0,0,0,0,0,0,1deadDIGU,,,1995-09-13T11:00:00Z,1995-09-13T11:25:00Z
Ocean Beach,FALL,1995,9/13/1995,12,Yes,12,0,0,0,0,0,0,0,0,2deadCOMU,,,1995-09-13T11:25:00Z,1995-09-13T11:35:00Z
Ocean Beach,FALL,1995,9/13/1995,13,No,22,0,0,0,0,0,0,0,0,,,,1995-09-13T11:35:00Z,1995-09-13T11:42:00Z
Ocean Beach,FALL,1995,9/13/1995,14,No,15,0,1,0,0,0,0,0,0,,,,1995-09-13T11:42:00Z,1995-09-13T11:50:00Z
Ocean Beach,FALL,1995,9/16/1995,1,No,116,0,0,2,0,0,0,0,0,5bikes,,,1995-09-16T14:43:00Z,1995-09-16T14:51:00Z
Ocean Beach,FALL,1995,9/16/1995,2,No,51,0,0,0,0,0,0,0,0,"1bike,1heli",,,1995-09-16T14:36:00Z,1995-09-16T14:43:00Z
Ocean Beach,FALL,1995,9/16/1995,3,No,75,1,0,2,0,0,0,0,0,4 bikes,,,1995-09-16T14:30:00Z,1995-09-16T14:36:00Z
Ocean Beach,FALL,1995,9/16/1995,4,Yes,89,2,1,3,0,0,0,0,0,"2planes,1kite",,,1995-09-16T14:18:00Z,1995-09-16T14:30:00Z
Ocean Beach,FALL,1995,9/16/1995,5,Yes,57,0,6,1,0,0,0,0,0,,,,1995-09-16T13:52:00Z,1995-09-16T14:18:00Z
Ocean Beach,FALL,1995,9/16/1995,6,Yes,30,0,2,1,0,0,0,0,0,,,,1995-09-16T13:40:00Z,1995-09-16T13:52:00Z
Ocean Beach,FALL,1995,9/16/1995,7,Yes,15,0,4,3,0,0,0,1,0,"1plane,1heli",,,1995-09-16T13:25:00Z,1995-09-16T13:40:00Z
Ocean Beach,FALL,1995,9/16/1995,8,Yes,27,0,0,2,0,0,0,0,0,,,,1995-09-16T13:23:00Z,1995-09-16T13:41:00Z
Ocean Beach,FALL,1995,9/16/1995,9,Yes,38,0,0,2,1,0,0,0,0,"2kites,1Army plane",,,1995-09-16T13:41:00Z,1995-09-16T14:24:00Z
Ocean Beach,FALL,1995,9/16/1995,10,Yes,47,0,0,1,0,0,0,0,0,1plane,,,1995-09-16T14:24:00Z,1995-09-16T14:36:00Z
Ocean Beach,FALL,1995,9/16/1995,11,Yes,40,0,2,0,0,0,0,0,0,"1plane,3fishrmn",,,1995-09-16T14:36:00Z,1995-09-16T14:47:00Z
Ocean Beach,FALL,1995,9/16/1995,12,Yes,60,0,0,1,0,0,0,0,0,2fishrmn,,,1995-09-16T14:47:00Z,1995-09-16T14:54:00Z
Ocean Beach,FALL,1995,9/16/1995,13,No,66,0,0,11,0,0,0,0,0,"2plane,6fishr,1heli",,,1995-09-16T14:54:00Z,1995-09-16T15:04:00Z
Ocean Beach,FALL,1995,9/16/1995,14,No,34,1,3,4,1,0,0,0,0,6fishrmn,,,1995-09-16T15:04:00Z,1995-09-16T15:13:00Z
Ocean Beach,FALL,1995,9/20/1995,1,No,8,0,1,0,0,0,0,0,0,,,,1995-09-20T10:43:00Z,1995-09-20T11:00:00Z
Ocean Beach,FALL,1995,9/20/1995,2,No,2,0,0,0,0,0,0,0,0,,,,1995-09-20T10:32:00Z,1995-09-20T10:43:00Z
Ocean Beach,FALL,1995,9/20/1995,3,No,1,0,0,1,0,0,0,0,0,,,,1995-09-20T10:20:00Z,1995-09-20T10:32:00Z
Ocean Beach,FALL,1995,9/20/1995,4,Yes,14,0,0,1,1,0,0,0,0,,,,1995-09-20T10:04:00Z,1995-09-20T10:20:00Z
Ocean Beach,FALL,1995,9/20/1995,5,Yes,8,0,1,1,0,0,0,0,0,,,,1995-09-20T09:39:00Z,1995-09-20T10:04:00Z
Ocean Beach,FALL,1995,9/20/1995,6,Yes,8,0,1,2,0,0,0,0,0,,,,1995-09-20T09:26:00Z,1995-09-20T09:39:00Z
Ocean Beach,FALL,1995,9/20/1995,7,Yes,2,0,0,1,0,0,0,0,0,,,,1995-09-20T09:15:00Z,1995-09-20T09:26:00Z
Ocean Beach,FALL,1995,9/20/1995,8,Yes,9,0,5,2,0,0,0,0,0,,,,1995-09-20T09:15:00Z,1995-09-20T09:37:00Z
Ocean Beach,FALL,1995,9/20/1995,9,Yes,11,0,0,0,0,0,0,0,0,,,,1995-09-20T09:37:00Z,1995-09-20T09:55:00Z
Ocean Beach,FALL,1995,9/20/1995,10,Yes,11,0,0,1,0,0,0,0,0,,,,1995-09-20T09:55:00Z,1995-09-20T10:15:00Z
Ocean Beach,FALL,1995,9/20/1995,11,Yes,4,0,0,1,0,0,0,0,0,,,,1995-09-20T10:15:00Z,1995-09-20T10:20:00Z
Ocean Beach,FALL,1995,9/20/1995,12,Yes,2,0,0,0,0,0,0,0,0,,,,1995-09-20T10:20:00Z,1995-09-20T10:27:00Z
Ocean Beach,FALL,1995,9/20/1995,13,No,10,0,0,1,0,0,0,0,0,,,,1995-09-20T10:27:00Z,1995-09-20T10:35:00Z
Ocean Beach,FALL,1995,9/20/1995,14,No,12,0,0,0,0,0,0,0,0,,,,1995-09-20T10:35:00Z,1995-09-20T10:47:00Z
Ocean Beach,FALL,1995,9/23/1995,1,No,184,1,1,1,0,0,0,0,0,2 kites,,,1995-09-23T16:12:00Z,1995-09-23T16:15:00Z
Ocean Beach,FALL,1995,9/23/1995,2,No,103,0,1,2,0,0,0,0,0,,,,1995-09-23T15:35:00Z,1995-09-23T16:12:00Z
Ocean Beach,FALL,1995,9/23/1995,3,No,137,1,0,1,0,0,0,0,0,,,,1995-09-23T15:21:00Z,1995-09-23T15:35:00Z
Ocean Beach,FALL,1995,9/23/1995,4,Yes,135,4,3,3,0,0,0,0,0,5 kites,,,1995-09-23T15:10:00Z,1995-09-23T15:21:00Z
Ocean Beach,FALL,1995,9/23/1995,5,Yes,87,0,2,5,0,0,0,0,0,,,,1995-09-23T14:50:00Z,1995-09-23T15:10:00Z
Ocean Beach,FALL,1995,9/23/1995,6,Yes,80,1,2,2,0,0,0,0,0,2 kites,,,1995-09-23T14:33:00Z,1995-09-23T14:50:00Z
Ocean Beach,FALL,1995,9/23/1995,7,Yes,46,0,0,2,1,0,0,0,0,,,,1995-09-23T14:17:00Z,1995-09-23T14:33:00Z
Ocean Beach,FALL,1995,9/23/1995,8,Yes,16,0,0,2,1,0,0,0,0,,,,1995-09-23T14:00:00Z,1995-09-23T14:10:00Z
Ocean Beach,FALL,1995,9/23/1995,9,Yes,18,0,0,1,0,0,0,0,0,"kidschasebirds,1kite",,,1995-09-23T14:10:00Z,1995-09-23T14:37:00Z
Ocean Beach,FALL,1995,9/23/1995,10,Yes,52,0,1,1,0,0,0,0,0,1dead corm,,,1995-09-23T14:37:00Z,1995-09-23T14:45:00Z
Ocean Beach,FALL,1995,9/23/1995,11,Yes,38,0,1,0,0,0,0,0,0,,,,1995-09-23T14:45:00Z,1995-09-23T14:51:00Z
Ocean Beach,FALL,1995,9/23/1995,12,Yes,139,0,1,4,0,0,0,0,0,,,,1995-09-23T14:51:00Z,1995-09-23T14:59:00Z
Ocean Beach,FALL,1995,9/23/1995,13,No,39,0,1,3,0,0,0,0,0,1 surfer,,,1995-09-23T14:59:00Z,1995-09-23T15:04:00Z
Ocean Beach,FALL,1995,9/23/1995,14,No,8,0,1,0,0,0,0,0,0,,,,1995-09-23T15:04:00Z,1995-09-23T15:08:00Z
Ocean Beach,FALL,1995,9/27/1995,1,No,7,0,0,0,0,0,0,0,0,,,,1995-09-27T11:15:00Z,1995-09-27T11:25:00Z
Ocean Beach,FALL,1995,9/27/1995,2,No,10,0,0,0,0,0,0,0,0,,,,1995-09-27T11:05:00Z,1995-09-27T11:15:00Z
Ocean Beach,FALL,1995,9/27/1995,3,No,7,0,1,0,0,0,0,0,0,,,,1995-09-27T10:55:00Z,1995-09-27T11:05:00Z
Ocean Beach,FALL,1995,9/27/1995,4,Yes,6,0,2,1,0,0,0,0,0,,,,1995-09-27T10:40:00Z,1995-09-27T10:55:00Z
Ocean Beach,FALL,1995,9/27/1995,5,Yes,16,0,2,3,1,1,4,0,0,,,,1995-09-27T10:10:00Z,1995-09-27T10:40:00Z
Ocean Beach,FALL,1995,9/27/1995,6,Yes,13,0,2,0,0,0,0,0,0,,,,1995-09-27T09:50:00Z,1995-09-27T10:10:00Z
Ocean Beach,FALL,1995,9/27/1995,7,Yes,11,0,2,1,1,0,0,0,0,,,,1995-09-27T09:30:00Z,1995-09-27T09:50:00Z
Ocean Beach,FALL,1995,9/27/1995,8,Yes,16,2,1,0,1,0,0,0,0,dead sea lion,,,1995-09-27T09:27:00Z,1995-09-27T09:54:00Z
Ocean Beach,FALL,1995,9/27/1995,9,Yes,8,0,0,0,0,0,0,0,0,deadpigeon guillemot,,,1995-09-27T09:54:00Z,1995-09-27T10:16:00Z
Ocean Beach,FALL,1995,9/27/1995,10,Yes,2,0,0,0,0,0,0,0,0,,,,1995-09-27T10:16:00Z,1995-09-27T10:31:00Z
Ocean Beach,FALL,1995,9/27/1995,11,Yes,7,0,0,2,0,0,0,0,0,,,,1995-09-27T10:31:00Z,1995-09-27T10:45:00Z
Ocean Beach,FALL,1995,9/27/1995,12,Yes,1,0,0,0,0,0,0,0,0,,,,1995-09-27T10:45:00Z,1995-09-27T10:53:00Z
Ocean Beach,FALL,1995,9/27/1995,13,No,4,0,0,1,0,0,0,0,0,,,,1995-09-27T10:53:00Z,1995-09-27T11:05:00Z
Ocean Beach,FALL,1995,9/27/1995,14,No,9,0,1,0,0,0,0,0,0,,,,1995-09-27T11:05:00Z,1995-09-27T11:10:00Z
Ocean Beach,FALL,1995,9/30/1995,1,No,179,4,1,2,0,0,0,0,0,,,,1995-09-30T15:05:00Z,1995-09-30T15:17:00Z
Ocean Beach,FALL,1995,9/30/1995,2,No,123,1,1,2,0,0,0,0,0,,,,1995-09-30T14:52:00Z,1995-09-30T15:05:00Z
Ocean Beach,FALL,1995,9/30/1995,3,No,271,2,5,2,0,0,0,0,0,,,,1995-09-30T14:37:00Z,1995-09-30T14:52:00Z
Ocean Beach,FALL,1995,9/30/1995,4,Yes,180,2,3,4,0,0,0,0,0,,,,1995-09-30T14:20:00Z,1995-09-30T14:37:00Z
Ocean Beach,FALL,1995,9/30/1995,5,Yes,223,2,3,4,2,0,0,0,0,,,,1995-09-30T13:57:00Z,1995-09-30T14:20:00Z
Ocean Beach,FALL,1995,9/30/1995,6,Yes,63,0,2,3,0,0,0,1,0,combined with sec.7,,,1995-09-30T13:39:00Z,1995-09-30T13:57:00Z
Ocean Beach,FALL,1995,9/30/1995,7,Yes,63,1,2,3,0,0,0,1,0,divided into sec.6,,,1995-09-30T13:21:00Z,1995-09-30T13:39:00Z
Ocean Beach,FALL,1995,9/30/1995,8,Yes,43,1,0,3,0,0,0,0,0,,,,1995-09-30T13:21:00Z,1995-09-30T13:31:00Z
Ocean Beach,FALL,1995,9/30/1995,9,Yes,42,1,5,0,0,0,0,0,0,3 kites,,,1995-09-30T13:31:00Z,1995-09-30T13:57:00Z
Ocean Beach,FALL,1995,9/30/1995,10,Yes,47,2,2,0,0,0,0,2,0,"1heli,1plane",,,1995-09-30T13:57:00Z,1995-09-30T14:10:00Z
Ocean Beach,FALL,1995,9/30/1995,11,Yes,36,1,3,2,0,0,0,0,0,1 plane,,,1995-09-30T14:10:00Z,1995-09-30T14:18:00Z
Ocean Beach,FALL,1995,9/30/1995,12,Yes,24,0,2,1,0,0,0,0,0,1 heli,,,1995-09-30T14:18:00Z,1995-09-30T14:25:00Z
Ocean Beach,FALL,1995,9/30/1995,13,No,146,4,13,4,0,0,0,0,0,,,,1995-09-30T14:25:00Z,1995-09-30T14:35:00Z
Ocean Beach,FALL,1995,9/30/1995,14,No,65,1,4,3,0,0,0,0,0,,,,1995-09-30T14:35:00Z,1995-09-30T14:35:00Z
Ocean Beach,FALL,1995,10/4/1995,1,No,37,0,1,0,0,0,0,0,1,buldozr moving sand,,,1995-10-04T11:07:00Z,1995-10-04T11:15:00Z
Ocean Beach,FALL,1995,10/4/1995,2,No,3,0,0,0,0,0,0,0,0,man on bike,,,1995-10-04T11:00:00Z,1995-10-04T11:07:00Z
Ocean Beach,FALL,1995,10/4/1995,3,No,25,0,0,0,0,0,0,0,0,,,,1995-10-04T10:50:00Z,1995-10-04T11:00:00Z
Ocean Beach,FALL,1995,10/4/1995,4,Yes,15,1,2,0,0,0,0,0,1,bulldozer by wall,,,1995-10-04T10:30:00Z,1995-10-04T10:50:00Z
Ocean Beach,FALL,1995,10/4/1995,5,Yes,34,0,2,1,2,0,0,0,0,,,,1995-10-04T10:00:00Z,1995-10-04T10:30:00Z
Ocean Beach,FALL,1995,10/4/1995,6,Yes,12,0,3,0,0,0,0,0,0,,,,1995-10-04T09:40:00Z,1995-10-04T10:00:00Z
Ocean Beach,FALL,1995,10/4/1995,7,Yes,4,0,0,2,1,0,0,0,0,,,,1995-10-04T09:30:00Z,1995-10-04T09:40:00Z
Ocean Beach,FALL,1995,10/4/1995,8,Yes,10,0,0,3,0,0,0,0,0,,,,1995-10-04T09:30:00Z,1995-10-04T09:52:00Z
Ocean Beach,FALL,1995,10/4/1995,9,Yes,12,0,4,0,2,0,0,0,0,,,,1995-10-04T09:52:00Z,1995-10-04T10:22:00Z
Ocean Beach,FALL,1995,10/4/1995,10,Yes,8,0,0,0,0,0,0,0,0,,,,1995-10-04T10:22:00Z,1995-10-04T10:34:00Z
Ocean Beach,FALL,1995,10/4/1995,11,Yes,5,0,1,0,0,0,0,0,0,vehicle tracks,,,1995-10-04T10:34:00Z,1995-10-04T10:45:00Z
Ocean Beach,FALL,1995,10/4/1995,12,Yes,4,0,0,0,0,0,0,0,0,,,,1995-10-04T10:45:00Z,1995-10-04T10:51:00Z
Ocean Beach,FALL,1995,10/4/1995,13,No,10,0,0,0,0,0,0,0,0,,,,1995-10-04T10:51:00Z,1995-10-04T10:58:00Z
Ocean Beach,FALL,1995,10/4/1995,14,No,11,0,1,0,1,0,0,0,0,,,,1995-10-04T10:58:00Z,1995-10-04T11:05:00Z
Ocean Beach,FALL,1995,10/14/1995,1,No,142,1,2,1,0,0,0,1,0,,,,1995-10-14T14:45:00Z,1995-10-14T15:00:00Z
Ocean Beach,FALL,1995,10/14/1995,2,No,103,0,3,1,0,0,0,0,0,1 kite,,,1995-10-14T14:29:00Z,1995-10-14T14:45:00Z
Ocean Beach,FALL,1995,10/14/1995,3,No,196,0,5,1,0,0,0,0,0,,,,1995-10-14T14:10:00Z,1995-10-14T14:29:00Z
Ocean Beach,FALL,1995,10/14/1995,4,Yes,215,1,4,4,0,0,0,0,0,1 kite,,,1995-10-14T13:50:00Z,1995-10-14T14:10:00Z
Ocean Beach,FALL,1995,10/14/1995,5,Yes,101,0,3,0,0,0,0,5,0,,,,1995-10-14T13:36:00Z,1995-10-14T13:50:00Z
Ocean Beach,FALL,1995,10/14/1995,6,Yes,120,2,0,0,0,0,0,0,0,1 heli,,,1995-10-14T13:28:00Z,1995-10-14T13:36:00Z
Ocean Beach,FALL,1995,10/14/1995,7,Yes,46,2,4,0,0,0,0,2,0,,,,1995-10-14T13:20:00Z,1995-10-14T13:28:00Z
Ocean Beach,FALL,1995,10/14/1995,8,Yes,15,1,4,2,0,0,0,2,0,1 heli,,,1995-10-14T13:20:00Z,1995-10-14T13:41:00Z
Ocean Beach,FALL,1995,10/14/1995,9,Yes,7,0,0,0,0,0,0,0,0,2 kites,,,1995-10-14T13:41:00Z,1995-10-14T14:05:00Z
Ocean Beach,FALL,1995,10/14/1995,10,Yes,30,1,7,0,0,0,0,0,0,,,,1995-10-14T14:05:00Z,1995-10-14T14:17:00Z
Ocean Beach,FALL,1995,10/14/1995,11,Yes,27,1,5,0,0,0,0,5,0,,,,1995-10-14T14:17:00Z,1995-10-14T14:25:00Z
Ocean Beach,FALL,1995,10/14/1995,12,Yes,74,3,7,0,0,0,0,0,0,,,,1995-10-14T14:25:00Z,1995-10-14T14:32:00Z
Ocean Beach,FALL,1995,10/14/1995,13,No,172,2,6,0,0,0,0,0,0,,,,1995-10-14T14:32:00Z,1995-10-14T14:40:00Z
Ocean Beach,FALL,1995,10/14/1995,14,No,52,2,1,0,0,0,0,0,0,,,,1995-10-14T14:40:00Z,1995-10-14T14:55:00Z
Ocean Beach,FALL,1995,10/18/1995,1,No,13,0,1,1,0,0,0,0,1,tractor moving sand,,,1995-10-18T11:24:00Z,1995-10-18T11:37:00Z
Ocean Beach,FALL,1995,10/18/1995,2,No,12,0,0,1,0,0,0,0,0,,,,1995-10-18T11:10:00Z,1995-10-18T11:24:00Z
Ocean Beach,FALL,1995,10/18/1995,3,No,17,0,1,1,2,0,0,0,0,tractor marks,,,1995-10-18T10:55:00Z,1995-10-18T11:10:00Z
Ocean Beach,FALL,1995,10/18/1995,4,Yes,26,0,0,4,0,0,0,0,3,3 SFPD cycles,,,1995-10-18T10:26:00Z,1995-10-18T10:55:00Z
Ocean Beach,FALL,1995,10/18/1995,5,Yes,20,0,1,3,0,0,0,0,0,1 heli,,,1995-10-18T10:07:00Z,1995-10-18T10:26:00Z
Ocean Beach,FALL,1995,10/18/1995,6,Yes,11,0,2,1,0,0,0,0,0,cycle tracks,,,1995-10-18T09:49:00Z,1995-10-18T10:07:00Z
Ocean Beach,FALL,1995,10/18/1995,7,Yes,15,0,1,1,0,0,0,0,0,,,,1995-10-18T09:37:00Z,1995-10-18T09:49:00Z
Ocean Beach,FALL,1995,10/18/1995,8,Yes,7,0,0,4,0,0,0,0,0,,,,1995-10-18T09:34:00Z,1995-10-18T09:48:00Z
Ocean Beach,FALL,1995,10/18/1995,9,Yes,24,0,2,3,0,0,2,0,0,"1heli,jogr dist snpl",,,1995-10-18T09:48:00Z,1995-10-18T10:19:00Z
Ocean Beach,FALL,1995,10/18/1995,10,Yes,7,0,0,0,1,0,0,0,0,,,,1995-10-18T10:19:00Z,1995-10-18T10:39:00Z
Ocean Beach,FALL,1995,10/18/1995,11,Yes,4,0,0,0,0,0,0,0,3,SFPDcycles,,,1995-10-18T10:39:00Z,1995-10-18T10:49:00Z
Ocean Beach,FALL,1995,10/18/1995,12,Yes,3,0,0,0,0,0,0,0,0,,,,1995-10-18T10:49:00Z,1995-10-18T10:56:00Z
Ocean Beach,FALL,1995,10/18/1995,13,No,10,0,2,1,0,0,0,0,0,,,,1995-10-18T10:56:00Z,1995-10-18T11:04:00Z
Ocean Beach,FALL,1995,10/18/1995,14,No,14,0,0,1,0,0,0,0,0,,,,1995-10-18T11:04:00Z,1995-10-18T11:13:00Z
Ocean Beach,FALL,1995,10/21/1995,1,No,23,2,2,1,0,0,0,0,0,,,,1995-10-21T15:31:00Z,1995-10-21T15:50:00Z
Ocean Beach,FALL,1995,10/21/1995,2,No,63,2,1,3,0,0,0,0,0,,,,1995-10-21T15:27:00Z,1995-10-21T15:31:00Z
Ocean Beach,FALL,1995,10/21/1995,3,No,160,2,5,2,0,0,0,1,0,,,,1995-10-21T15:15:00Z,1995-10-21T15:27:00Z
Ocean Beach,FALL,1995,10/21/1995,4,Yes,131,2,4,1,1,0,0,1,0,,,,1995-10-21T14:57:00Z,1995-10-21T15:15:00Z
Ocean Beach,FALL,1995,10/21/1995,5,Yes,107,0,4,4,0,0,7,0,0,hmans dist. SNPLs,,,1995-10-21T14:26:00Z,1995-10-21T14:57:00Z
Ocean Beach,FALL,1995,10/21/1995,6,Yes,76,0,4,3,1,0,0,0,0,,,,1995-10-21T14:09:00Z,1995-10-21T14:26:00Z
Ocean Beach,FALL,1995,10/21/1995,7,Yes,35,1,7,1,0,0,0,10,1,"PRtruck,1bike",,,1995-10-21T13:43:00Z,1995-10-21T14:09:00Z
Ocean Beach,FALL,1995,10/21/1995,8,Yes,27,0,2,6,3,0,0,15,0,1 bike,,,1995-10-21T13:42:00Z,1995-10-21T14:00:00Z
Ocean Beach,FALL,1995,10/21/1995,9,Yes,37,2,6,2,2,2,0,0,1,"3bike,1kite,PStruck",,,1995-10-21T14:00:00Z,1995-10-21T14:31:00Z
Ocean Beach,FALL,1995,10/21/1995,10,Yes,40,0,1,1,0,0,0,0,0,,,,1995-10-21T14:31:00Z,1995-10-21T14:51:00Z
Ocean Beach,FALL,1995,10/21/1995,11,Yes,43,0,2,5,0,0,0,0,0,,,,1995-10-21T14:51:00Z,1995-10-21T15:04:00Z
Ocean Beach,FALL,1995,10/21/1995,12,Yes,42,0,1,2,0,0,0,0,0,,,,1995-10-21T15:04:00Z,1995-10-21T15:11:00Z
Ocean Beach,FALL,1995,10/21/1995,13,No,67,0,2,3,0,0,0,0,0,,,,1995-10-21T15:11:00Z,1995-10-21T15:21:00Z
Ocean Beach,FALL,1995,10/21/1995,14,No,30,0,2,1,0,0,0,0,0,,,,1995-10-21T15:21:00Z,1995-10-21T15:33:00Z
Ocean Beach,FALL,1995,10/25/1995,1,No,3,0,0,0,0,0,0,0,0,,,,1995-10-25T10:26:00Z,1995-10-25T10:31:00Z
Ocean Beach,FALL,1995,10/25/1995,2,No,9,0,0,2,1,0,0,0,0,,,,1995-10-25T10:16:00Z,1995-10-25T10:26:00Z
Ocean Beach,FALL,1995,10/25/1995,3,No,6,0,1,3,1,0,0,0,0,,,,1995-10-25T10:09:00Z,1995-10-25T10:16:00Z
Ocean Beach,FALL,1995,10/25/1995,4,Yes,10,1,1,4,1,0,0,0,0,,,,1995-10-25T09:52:00Z,1995-10-25T10:09:00Z
Ocean Beach,FALL,1995,10/25/1995,5,Yes,4,0,0,2,0,0,0,0,0,,,,1995-10-25T09:39:00Z,1995-10-25T09:52:00Z
Ocean Beach,FALL,1995,10/25/1995,6,Yes,11,0,0,5,2,0,2,0,0,"tracks,DCaggresively",,,1995-10-25T09:18:00Z,1995-10-25T09:39:00Z
Ocean Beach,FALL,1995,10/25/1995,7,Yes,7,0,0,3,0,0,0,0,0,VH tracks,,,1995-10-25T09:07:00Z,1995-10-25T09:18:00Z
Ocean Beach,FALL,1995,10/25/1995,8,Yes,6,1,0,0,0,0,0,0,0,VH tracks,,,1995-10-25T09:10:00Z,1995-10-25T09:35:00Z
Ocean Beach,FALL,1995,10/25/1995,9,Yes,10,1,1,6,0,0,20,0,0,DRs barkingloud near,,,1995-10-25T09:35:00Z,1995-10-25T10:00:00Z
Ocean Beach,FALL,1995,10/25/1995,10,Yes,6,0,0,1,0,0,0,0,0,,,,1995-10-25T10:00:00Z,1995-10-25T10:14:00Z
Ocean Beach,FALL,1995,10/25/1995,11,Yes,5,0,0,3,1,0,0,0,0,,,,1995-10-25T10:14:00Z,1995-10-25T10:25:00Z
Ocean Beach,FALL,1995,10/25/1995,12,Yes,5,0,0,0,0,0,0,0,0,,,,1995-10-25T10:25:00Z,1995-10-25T10:32:00Z
Ocean Beach,FALL,1995,10/25/1995,13,No,7,0,0,4,0,0,0,0,0,,,,1995-10-25T10:32:00Z,1995-10-25T10:40:00Z
Ocean Beach,FALL,1995,10/25/1995,14,No,14,0,0,1,0,0,0,0,0,,,,1995-10-25T10:40:00Z,1995-10-25T10:53:00Z
Ocean Beach,FALL,1995,10/28/1995,4,Yes,24,0,0,4,0,0,0,0,0,,,,1995-10-28T14:30:00Z,1995-10-28T14:45:00Z
Ocean Beach,FALL,1995,10/28/1995,5,Yes,19,0,0,3,0,0,0,0,0,,,,1995-10-28T14:10:00Z,1995-10-28T14:30:00Z
Ocean Beach,FALL,1995,10/28/1995,6,Yes,17,0,1,1,0,0,0,0,0,,,,1995-10-28T14:00:00Z,1995-10-28T14:10:00Z
Ocean Beach,FALL,1995,10/28/1995,7,Yes,3,0,0,0,0,0,0,0,0,,,,1995-10-28T13:50:00Z,1995-10-28T14:00:00Z
Ocean Beach,FALL,1995,10/28/1995,8,Yes,9,0,0,2,0,0,0,0,0,,,,1995-10-28T13:35:00Z,1995-10-28T13:50:00Z
Ocean Beach,FALL,1995,10/28/1995,9,Yes,14,0,0,1,0,0,0,0,0,,,,1995-10-28T13:00:00Z,1995-10-28T13:35:00Z
Ocean Beach,WINTER,1995,11/1/1995,1,No,13,0,2,0,0,0,0,0,0,sand moved recently,,,1995-11-01T10:24:00Z,1995-11-01T10:34:00Z
Ocean Beach,WINTER,1995,11/1/1995,2,No,15,0,1,0,1,0,0,0,0,owner no react to DC,,,1995-11-01T10:16:00Z,1995-11-01T10:24:00Z
Ocean Beach,WINTER,1995,11/1/1995,3,No,8,0,2,2,1,0,0,0,0,owner unknown,,,1995-11-01T10:07:00Z,1995-11-01T10:16:00Z
Ocean Beach,WINTER,1995,11/1/1995,4,Yes,13,0,0,1,1,0,0,0,0,owner no react to DC,,,1995-11-01T09:53:00Z,1995-11-01T10:07:00Z
Ocean Beach,WINTER,1995,11/1/1995,5,Yes,15,0,2,4,1,0,0,0,0,,,,1995-11-01T09:33:00Z,1995-11-01T09:53:00Z
Ocean Beach,WINTER,1995,11/1/1995,6,Yes,11,0,0,0,0,0,0,0,0,,,,1995-11-01T09:21:00Z,1995-11-01T09:33:00Z
Ocean Beach,WINTER,1995,11/1/1995,7,Yes,12,0,1,1,0,0,0,0,0,,,,1995-11-01T09:07:00Z,1995-11-01T09:21:00Z
Ocean Beach,WINTER,1995,11/1/1995,8,Yes,1,0,0,1,0,0,0,0,0,,,,1995-11-01T09:08:00Z,1995-11-01T09:21:00Z
Ocean Beach,WINTER,1995,11/1/1995,9,Yes,21,0,4,2,1,0,0,0,1,? no VH data,,,1995-11-01T09:21:00Z,1995-11-01T09:50:00Z
Ocean Beach,WINTER,1995,11/1/1995,10,Yes,5,0,1,0,0,0,0,0,0,,,,1995-11-01T09:50:00Z,1995-11-01T10:04:00Z
Ocean Beach,WINTER,1995,11/1/1995,11,Yes,11,0,0,1,0,0,0,0,0,,,,1995-11-01T10:04:00Z,1995-11-01T10:15:00Z
Ocean Beach,WINTER,1995,11/1/1995,12,Yes,10,0,1,2,0,0,0,0,0,,,,1995-11-01T10:15:00Z,1995-11-01T10:23:00Z
Ocean Beach,WINTER,1995,11/1/1995,13,No,7,0,0,1,0,0,0,0,0,,,,1995-11-01T10:23:00Z,1995-11-01T10:30:00Z
Ocean Beach,WINTER,1995,11/1/1995,14,No,16,1,5,2,0,0,0,0,0,,,,1995-11-01T10:30:00Z,1995-11-01T10:40:00Z
Ocean Beach,WINTER,1995,11/4/1995,1,No,66,0,2,7,0,0,0,0,0,1 plane,,,1995-11-04T14:40:00Z,1995-11-04T14:49:00Z
Ocean Beach,WINTER,1995,11/4/1995,2,No,45,0,0,0,0,0,0,0,0,people chasing gulls,,,1995-11-04T14:30:00Z,1995-11-04T14:40:00Z
Ocean Beach,WINTER,1995,11/4/1995,3,No,66,0,0,3,0,0,0,0,0,kid throw sand/gulls,,,1995-11-04T14:21:00Z,1995-11-04T14:30:00Z
Ocean Beach,WINTER,1995,11/4/1995,4,Yes,66,0,1,6,0,0,0,0,0,,,,1995-11-04T14:00:00Z,1995-11-04T14:21:00Z
Ocean Beach,WINTER,1995,11/4/1995,5,Yes,42,0,0,1,0,0,0,1,0,"USPPhorse,1dead bird",,,1995-11-04T13:46:00Z,1995-11-04T14:00:00Z
Ocean Beach,WINTER,1995,11/4/1995,6,Yes,34,0,0,4,1,0,0,0,0,dead grebe,,,1995-11-04T13:35:00Z,1995-11-04T13:46:00Z
Ocean Beach,WINTER,1995,11/4/1995,7,Yes,38,0,3,2,0,0,0,0,0,,,,1995-11-04T13:26:00Z,1995-11-04T13:35:00Z
Ocean Beach,WINTER,1995,11/4/1995,8,Yes,25,0,1,2,0,0,0,2,0,,,,1995-11-04T13:15:00Z,1995-11-04T13:25:00Z
Ocean Beach,WINTER,1995,11/4/1995,9,Yes,35,0,2,0,1,0,0,0,0,,,,1995-11-04T13:25:00Z,1995-11-04T14:00:00Z
Ocean Beach,WINTER,1995,11/4/1995,10,Yes,33,1,5,2,0,0,0,0,0,,,,1995-11-04T14:00:00Z,1995-11-04T14:15:00Z
Ocean Beach,WINTER,1995,11/4/1995,11,Yes,26,0,2,1,1,0,0,0,0,,,,1995-11-04T14:15:00Z,1995-11-04T14:25:00Z
